Share Lore (5th level),You are sharing your knowledge with the touched creatures. All targets become trained in up to two chosen Lore skills in which the caster is trained for the duration of the spell.,Skills,spells,Share Lore (1st level),,,,,,TRUE,All targets become trained in two chosen Lore skills in which the caster is trained for the duration of the spell.,,,,,,,,,,,,,,,,,,,,,,,,,,,,,,,,,,,,,,,,,,,,,,,,,,,,,,,,,,,,,,,,,,,,,,,,,,,,,,,,,,,,,,,,,,,,,,,,,,,,,,,,,,,,,,,,,,,,,,,,,,,,,,,,,,,,,,,,,,,,,,,,,,,,,,,,,,,,,,,,,,,,,,,,,,,,,,,,,,,,,,,,,,,,,,,,,,,,,,,,,,,,,,,,,,,,,,,,,,,,,,,,,,,,,,,,,,,,,,,,,,,,,,,,,,,,,,,,,,
Shattering Gem,"A large gem floats around you in an erratic pattern. The gem has 5 Hit Points per spell level. Each time a creature Strikes you, you attempts a DC 11 flat check. On a success, the gem blocks the attack, so the attack first damages the gem and then applies any remaining damage to you. If the gem is reduced to 0 Hit Points, it shatters, immediately dealing the creature that destroyed it 1d8 slashing damage per spell level (basic Reflex save), as long as that creature is within 10 feet of you.",AC,spells,,,,,,,TRUE,"A large gem floats around you in an erratic pattern. The gem has 5 Hit Points per spell level. Each time a creature Strikes you, you attempts a DC 11 flat check. On a success, the gem blocks the attack, so the attack first damages the gem and then applies any remaining damage to you. If the gem is reduced to 0 Hit Points, it shatters, immediately dealing the creature that destroyed it 1d8 slashing damage per spell level (basic Reflex save), as long as that creature is within 10 feet of you.",,,,,,,,,,,,,,,,,,,,,,,,,,,,,,,,,,,,,,,,,,,,,,,,,,,,,,,,,,,,,,,,,,,,,,,,,,,,,,,,,,,,,,,,,,,,,,,,,,,,,,,,,,,,,,,,,,,,,,,,,,,,,,,,,,,,,,,,,,,,,,,,,,,,,,,,,,,,,,,,,,,,,,,,,,,,,,,,,,,,,,,,,,,,,,,,,,,,,,,,,,,,,,,,,,,,,,,,,,,,,,,,,,,,,,,,,,,,,,,,,,,,,,,,,,,,,,,,,,
Soothe,"Your mind's mental defenses are boosted, and your wounds are healed. You regain 1d10+4 Hit Points per spell level when the Spell is Cast and gain a +2 status bonus to saves against mental effects for the duration.",Will,spells,,,,,,,TRUE,You gain a +2 status bonus to saves against mental effects for the duration.,You regain 1d10+4 Hit Points per spell level when the Spell is Cast.,,,,,,,,,,,,,,,,,,,,,,,,,,,,,,,,,,,,,,,,,,,,,,,,,,,,,,,,,,,,,,,,,,,,,,,,,,,,,,,,,,,,,,,,,,,,,,,,,,,,,,,,,,,,,,,,,,,,,,,,,,,,,,,,,,,,,,,,,,,,,,,,,,,,,,,,,,,,,,,,,,,,,,,,,,,,,,,,,,,,,,,,,,,,,,,,,,,,,,,,,,,,,,,,,,,,,,,,,,,,,,,,,,,,,,,,,,,,,,,,,,,,,,,,,,,,,,,,,
Spirit Link (Caster),"You have formed a spiritual link with another creature, allowing you to take in its pain. When you Cast this Spell and at the start of each of your turns, if the target is below maximum Hit Points, it regains 2 Hit Points per spell level (or the difference between its current and maximum Hit Points, if that's lower). You lose as many Hit Points as the target regained.

This is a spiritual transfer, so no effects apply that would increase the Hit Points the target regains or decrease the Hit Points you lose. This transfer also ignores any temporary Hit Points you or the target have. Since this effect doesn't involve positive or negative energy, spirit link works even if you or the target is undead. While the duration persists, you gain no benefit from regeneration or fast healing. You can Dismiss this spell, and if you're ever at 0 Hit Points, spirit link ends automatically.",Health,spells,,,,,,,TRUE,"At the start of each of your turns, if the target is below maximum Hit Points, it regains 2 Hit Points per spell level (or the difference between its current and maximum Hit Points, if that's lower). You lose as many Hit Points as the target regained.","When you Cast this Spell and at the start of each of your turns, if the target is below maximum Hit Points, it regains 2 Hit Points per spell level (or the difference between its current and maximum Hit Points, if that's lower). You lose as many Hit Points as the target regained.",,,,,,,,,,,,,,,,,,,,,,,,,,,,,,,,,,,,,,,,,,,,,,,,,,,,,,,,,,,,,,,,,,,,,,,,,,,,,,,,,,,,,,,,,,,,,,,,,,,,,,,,,,,,,,,,,,,,,,,,,,,,,,,,,,,,,,,,,,,,,,,,,,,,,,,,,,,,,,,,,,,,,,,,,,,,,,,,,,,,,,,,,,,,,,,,,,,,,,,,,,,,,,,,,,,,,,,,,,,,,,,,,,,,,,,,,,,,,,,,,,,,,,,,,,,,,,,,,
Spirit Link,"You have formed a spiritual link with the caster, allowing them to take in your pain. When the Spell is Cast and at the start of each of your turns, if the you are below maximum Hit Points, you regains 2 Hit Points per spell level (or the difference between your current and maximum Hit Points, if that's lower). The caster loses as many Hit Points as you regained.

This is a spiritual transfer, so no effects apply that would increase the Hit Points you regain or decrease the Hit Points the caster loses. This transfer also ignores any temporary Hit Points you or the caster have. Since this effect doesn't involve positive or negative energy, spirit link works even if you or the caster is undead.",Health,spells,,,,,,,TRUE,"At the start of each of your turns, if you are below maximum Hit Points, you regains 2 Hit Points per spell level (or the difference between its current and maximum Hit Points, if that's lower). The caster loses as many Hit Points as you regained.","When you Cast this Spell and at the start of each of your turns, if you are below maximum Hit Points, you regain 2 Hit Points per spell level (or the difference between its current and maximum Hit Points, if that's lower). The caster loses as many Hit Points as you regained.",,,,,,,,,,,,,,,,,,,,,,,,,,,,,,,,,,,,,,,,,,,,,,,,,,,,,,,,,,,,,,,,,,,,,,,,,,,,,,,,,,,,,,,,,,,,,,,,,,,,,,,,,,,,,,,,,,,,,,,,,,,,,,,,,,,,,,,,,,,,,,,,,,,,,,,,,,,,,,,,,,,,,,,,,,,,,,,,,,,,,,,,,,,,,,,,,,,,,,,,,,,,,,,,,,,,,,,,,,,,,,,,,,,,,,,,,,,,,,,,,,,,,,,,,,,,,,,,,
Summon Animal,"You have summoned an animal to fight for you. It is a common creature with the animal trait.

A creature called by a conjuration spell or effect gains the summoned trait. A summoned creature can't summon other creatures, create things of value, or cast spells that require a cost. It has the minion trait. If it tries to cast a spell of equal or higher level than the spell that summoned it, it overpowers the summoning magic, causing the summoned creature's spell to fail and the summon spell to end. Otherwise, the summoned creature uses the standard abilities for a creature of its kind. It generally attacks your enemies to the best of its abilities. If you can communicate with it, you can attempt to command it, but the GM determines the degree to which it follows your commands.

Immediately when you finish Casting the Spell, the summoned creature uses its 2 actions for that turn. Summoned creatures can be banished by various spells and effects. They are automatically banished if reduced to 0 Hit Points or if the spell that called them ends.",,spells,,,,,,,TRUE,,,,,,,,,,,,,,,,,,,,,,,,,,,,,,,,,,,,,,,,,,,,,,,,,,,,,,,,,,,,,,,,,,,,,,,,,,,,,,,,,,,,,,,,,,,,,,,,,,,,,,,,,,,,,,,,,,,,,,,,,,,,,,,,,,,,,,,,,,,,,,,,,,,,,,,,,,,,,,,,,,,,,,,,,,,,,,,,,,,,,,,,,,,,,,,,,,,,,,,,,,,,,,,,,,,,,,,,,,,,,,,,,,,,,,,,,,,,,,,,,,,,,,,,,,,,,,,,,,,
Summon Construct,"You have conjured a construct to fight for you. It is a common creature with the construct trait.

A creature called by a conjuration spell or effect gains the summoned trait. A summoned creature can't summon other creatures, create things of value, or cast spells that require a cost. It has the minion trait. If it tries to cast a spell of equal or higher level than the spell that summoned it, it overpowers the summoning magic, causing the summoned creature's spell to fail and the summon spell to end. Otherwise, the summoned creature uses the standard abilities for a creature of its kind. It generally attacks your enemies to the best of its abilities. If you can communicate with it, you can attempt to command it, but the GM determines the degree to which it follows your commands.

Immediately when you finish Casting the Spell, the summoned creature uses its 2 actions for that turn. Summoned creatures can be banished by various spells and effects. They are automatically banished if reduced to 0 Hit Points or if the spell that called them ends.",,spells,,,,,,,TRUE,,,,,,,,,,,,,,,,,,,,,,,,,,,,,,,,,,,,,,,,,,,,,,,,,,,,,,,,,,,,,,,,,,,,,,,,,,,,,,,,,,,,,,,,,,,,,,,,,,,,,,,,,,,,,,,,,,,,,,,,,,,,,,,,,,,,,,,,,,,,,,,,,,,,,,,,,,,,,,,,,,,,,,,,,,,,,,,,,,,,,,,,,,,,,,,,,,,,,,,,,,,,,,,,,,,,,,,,,,,,,,,,,,,,,,,,,,,,,,,,,,,,,,,,,,,,,,,,,,,
Summon Plant or Fungus,"You have conjured a plant or fungus to fight for you. It is a common creature with the plant or fungus trait.

A creature called by a conjuration spell or effect gains the summoned trait. A summoned creature can't summon other creatures, create things of value, or cast spells that require a cost. It has the minion trait. If it tries to cast a spell of equal or higher level than the spell that summoned it, it overpowers the summoning magic, causing the summoned creature's spell to fail and the summon spell to end. Otherwise, the summoned creature uses the standard abilities for a creature of its kind. It generally attacks your enemies to the best of its abilities. If you can communicate with it, you can attempt to command it, but the GM determines the degree to which it follows your commands.

Immediately when you finish Casting the Spell, the summoned creature uses its 2 actions for that turn. Summoned creatures can be banished by various spells and effects. They are automatically banished if reduced to 0 Hit Points or if the spell that called them ends.",,spells,,,,,,,TRUE,,,,,,,,,,,,,,,,,,,,,,,,,,,,,,,,,,,,,,,,,,,,,,,,,,,,,,,,,,,,,,,,,,,,,,,,,,,,,,,,,,,,,,,,,,,,,,,,,,,,,,,,,,,,,,,,,,,,,,,,,,,,,,,,,,,,,,,,,,,,,,,,,,,,,,,,,,,,,,,,,,,,,,,,,,,,,,,,,,,,,,,,,,,,,,,,,,,,,,,,,,,,,,,,,,,,,,,,,,,,,,,,,,,,,,,,,,,,,,,,,,,,,,,,,,,,,,,,,,,
Summon Fey,"You have conjured a fey to fight for you. It is a common creature with the fey trait.

A creature called by a conjuration spell or effect gains the summoned trait. A summoned creature can't summon other creatures, create things of value, or cast spells that require a cost. It has the minion trait. If it tries to cast a spell of equal or higher level than the spell that summoned it, it overpowers the summoning magic, causing the summoned creature's spell to fail and the summon spell to end. Otherwise, the summoned creature uses the standard abilities for a creature of its kind. It generally attacks your enemies to the best of its abilities. If you can communicate with it, you can attempt to command it, but the GM determines the degree to which it follows your commands.

Immediately when you finish Casting the Spell, the summoned creature uses its 2 actions for that turn. Summoned creatures can be banished by various spells and effects. They are automatically banished if reduced to 0 Hit Points or if the spell that called them ends.",,spells,,,,,,,TRUE,,,,,,,,,,,,,,,,,,,,,,,,,,,,,,,,,,,,,,,,,,,,,,,,,,,,,,,,,,,,,,,,,,,,,,,,,,,,,,,,,,,,,,,,,,,,,,,,,,,,,,,,,,,,,,,,,,,,,,,,,,,,,,,,,,,,,,,,,,,,,,,,,,,,,,,,,,,,,,,,,,,,,,,,,,,,,,,,,,,,,,,,,,,,,,,,,,,,,,,,,,,,,,,,,,,,,,,,,,,,,,,,,,,,,,,,,,,,,,,,,,,,,,,,,,,,,,,,,,,
Temporary Tool,"You have conjured a temporary simple tool, such as a shovel or rope into your hands. It lasts until it is used for a single activity or for 1 minute, whichever comes first, after which it disappears. The tool is obviously temporarily conjured, and thus can't be sold or passed off as a genuine item.",,spells,,,,,,,TRUE,,,,,,,,,,,,,,,,,,,,,,,,,,,,,,,,,,,,,,,,,,,,,,,,,,,,,,,,,,,,,,,,,,,,,,,,,,,,,,,,,,,,,,,,,,,,,,,,,,,,,,,,,,,,,,,,,,,,,,,,,,,,,,,,,,,,,,,,,,,,,,,,,,,,,,,,,,,,,,,,,,,,,,,,,,,,,,,,,,,,,,,,,,,,,,,,,,,,,,,,,,,,,,,,,,,,,,,,,,,,,,,,,,,,,,,,,,,,,,,,,,,,,,,,,,,,,,,,,,,
Tether (Caster),"You have used magical chains, vines, or other tethers to bind your target to you. The creature can still try to Escape, and it or others can break the tethers by attacking them. The tethers have AC 15 (plus 3 per spell level) and 10 Hit Points (plus 10 per spell level). You must stay within 30 feet of the target while it is tethered; moving more than 30 feet away from your target ends the spell. The target must attempt a Reflex save.

<strong>Critical Success</strong> The target is unaffected.
<strong>Success</strong> The target takes a -5-foot circumstance penalty to its Speed as long as it is within 30 feet of you.
<strong>Failure</strong> The target takes a -10-foot circumstance penalty to its Speed and cannot move more than 30 feet away from you until it Escapes or the spell ends.
<strong>Critical Failure</strong> The target is immobilized until it Escapes or the spell ends.",,spells,,,,,,,TRUE,,,,,,,,,,,,,,,,,,,,,,,,,,,,,,,,,,,,,,,,,,,,,,,,,,,,,,,,,,,,,,,,,,,,,,,,,,,,,,,,,,,,,,,,,,,,,,,,,,,,,,,,,,,,,,,,,,,,,,,,,,,,,,,,,,,,,,,,,,,,,,,,,,,,,,,,,,,,,,,,,,,,,,,,,,,,,,,,,,,,,,,,,,,,,,,,,,,,,,,,,,,,,,,,,,,,,,,,,,,,,,,,,,,,,,,,,,,,,,,,,,,,,,,,,,,,,,,,,,,
True Strike,"A glimpse into the future ensures your next blow strikes true. The next time you make an attack roll before the end of your turn, roll the attack twice and use the better result. The attack ignores circumstance penalties to the attack roll and any flat check required due to the target being concealed or hidden.",Attacks,spells,,,,,,,TRUE,"The next time you make an attack roll before the end of your turn, roll the attack twice and use the better result. The attack ignores circumstance penalties to the attack roll and any flat check required due to the target being concealed or hidden.",,,,,,,,,,,,,,,,,,,,,,,,,,,,,,,,,,,,,,,,,,,,,,,,,,,,,,,,,,,,,,,,,,,,,,,,,,,,,,,,,,,,,,,,,,,,,,,,,,,,,,,,,,,,,,,,,,,,,,,,,,,,,,,,,,,,,,,,,,,,,,,,,,,,,,,,,,,,,,,,,,,,,,,,,,,,,,,,,,,,,,,,,,,,,,,,,,,,,,,,,,,,,,,,,,,,,,,,,,,,,,,,,,,,,,,,,,,,,,,,,,,,,,,,,,,,,,,,,,
Unseen Servant,"You have summoned an unseen servant (Core Rulebook pg. 380), which you can command as part of Sustaining the Spell. It serves you until its Hit Points are reduced to 0, at which point the spell ends, or until you stop Sustaining the Spell. The unseen servant gains the summoned trait.

A creature called by a conjuration spell or effect gains the summoned trait. A summoned creature can't summon other creatures, create things of value, or cast spells that require a cost. It has the minion trait. If it tries to cast a spell of equal or higher level than the spell that summoned it, it overpowers the summoning magic, causing the summoned creature's spell to fail and the summon spell to end. Otherwise, the summoned creature uses the standard abilities for a creature of its kind. It generally attacks your enemies to the best of its abilities. If you can communicate with it, you can attempt to command it, but the GM determines the degree to which it follows your commands.

Immediately when you finish Casting the Spell, the summoned creature uses its 2 actions for that turn. Summoned creatures can be banished by various spells and effects. They are automatically banished if reduced to 0 Hit Points or if the spell that called them ends.",,spells,,,,,,,TRUE,,,,,,,,,,,,,,,,,,,,,,,,,,,,,,,,,,,,,,,,,,,,,,,,,,,,,,,,,,,,,,,,,,,,,,,,,,,,,,,,,,,,,,,,,,,,,,,,,,,,,,,,,,,,,,,,,,,,,,,,,,,,,,,,,,,,,,,,,,,,,,,,,,,,,,,,,,,,,,,,,,,,,,,,,,,,,,,,,,,,,,,,,,,,,,,,,,,,,,,,,,,,,,,,,,,,,,,,,,,,,,,,,,,,,,,,,,,,,,,,,,,,,,,,,,,,,,,,,,,
Ventriloquism (1st level),"Whenever you speak or make any other sound vocally, you can make your vocalization seem to originate from somewhere else within 60 feet, and you can change that apparent location freely as you vocalize. Any creature that hears the sound can attempt to disbelieve your illusion.",,spells,,,,,,,TRUE,,,,,,,,,,,,,,,,,,,,,,,,,,,,,,,,,,,,,,,,,,,,,,,,,,,,,,,,,,,,,,,,,,,,,,,,,,,,,,,,,,,,,,,,,,,,,,,,,,,,,,,,,,,,,,,,,,,,,,,,,,,,,,,,,,,,,,,,,,,,,,,,,,,,,,,,,,,,,,,,,,,,,,,,,,,,,,,,,,,,,,,,,,,,,,,,,,,,,,,,,,,,,,,,,,,,,,,,,,,,,,,,,,,,,,,,,,,,,,,,,,,,,,,,,,,,,,,,,,,
Ventriloquism (2nd level),"Whenever you speak or make any other sound vocally, you can make your vocalization seem to originate from somewhere else within 60 feet, and you can change that apparent location freely as you vocalize. You can also change the tone, quality, and other aspects of your voice. Before a creature can attempt to disbelieve your illusion, it must actively attempt a Perception check or otherwise use actions to interact with the sound.",,spells,Ventriloquism (1st level),,,,,,TRUE,,,,,,,,,,,,,,,,,,,,,,,,,,,,,,,,,,,,,,,,,,,,,,,,,,,,,,,,,,,,,,,,,,,,,,,,,,,,,,,,,,,,,,,,,,,,,,,,,,,,,,,,,,,,,,,,,,,,,,,,,,,,,,,,,,,,,,,,,,,,,,,,,,,,,,,,,,,,,,,,,,,,,,,,,,,,,,,,,,,,,,,,,,,,,,,,,,,,,,,,,,,,,,,,,,,,,,,,,,,,,,,,,,,,,,,,,,,,,,,,,,,,,,,,,,,,,,,,,,,
Stabilize,"Positive energy shuts death's door. The target loses the dying condition, though it remains unconscious at 0 Hit Points.",,spells,,,,,,,TRUE,,,,,,,Dying,,,,,,,,,,,,,,,,,,,,,,,,,,,,,,,,,,,,,,,,,,,,,,,,,,,,,,,,,,,,,,,,,,,,,,,,,,,,,,,,,,,,,,,,,,,,,,,,,,,,,,,,,,,,,,,,,,,,,,,,,,,,,,,,,,,,,,,,,,,,,,,,,,,,,,,,,,,,,,,,,,,,,,,,,,,,,,,,,,,,,,,,,,,,,,,,,,,,,,,,,,,,,,,,,,,,,,,,,,,,,,,,,,,,,,,,,,,,,,,,,,,,,,,,,,,,
Disrupting Weapons (1st level),Two of your weapons are infused with positive energy. Attacks with these weapons deal an extra 1d4 positive damage to undead.,Attacks,spells,,,,,,,TRUE,Two of your weapons are infused with positive energy. Attacks with these weapons deal an extra 1d4 positive damage to undead.,,,,,,,,,,,,,,,,,,,,,,,,,,,,,,,,,,,,,,,,,,,,,,,,,,,,,,,,,,,,,,,,,,,,,,,,,,,,,,,,,,,,,,,,,,,,,,,,,,,,,,,,,,,,,,,,,,,,,,,,,,,,,,,,,,,,,,,,,,,,,,,,,,,,,,,,,,,,,,,,,,,,,,,,,,,,,,,,,,,,,,,,,,,,,,,,,,,,,,,,,,,,,,,,,,,,,,,,,,,,,,,,,,,,,,,,,,,,,,,,,,,,,,,,,,,,,,,,,,
Disrupting Weapons (3rd level),Two of your weapons are infused with positive energy. Attacks with these weapons deal an extra 2d4 positive damage to undead.,Attacks,spells,Disrupting Weapons (1st level),,,,,,TRUE,Two of your weapons are infused with positive energy. Attacks with these weapons deal an extra 2d4 positive damage to undead.,,,,,,,,,,,,,,,,,,,,,,,,,,,,,,,,,,,,,,,,,,,,,,,,,,,,,,,,,,,,,,,,,,,,,,,,,,,,,,,,,,,,,,,,,,,,,,,,,,,,,,,,,,,,,,,,,,,,,,,,,,,,,,,,,,,,,,,,,,,,,,,,,,,,,,,,,,,,,,,,,,,,,,,,,,,,,,,,,,,,,,,,,,,,,,,,,,,,,,,,,,,,,,,,,,,,,,,,,,,,,,,,,,,,,,,,,,,,,,,,,,,,,,,,,,,,,,,,,,
Disrupting Weapons (5th level),Three of your weapons are infused with positive energy. Attacks with these weapons deal an extra 3d4 positive damage to undead.,Attacks,spells,Disrupting Weapons (3rd level),,,,,,TRUE,Three of your weapons are infused with positive energy. Attacks with these weapons deal an extra 3d4 positive damage to undead.,,,,,,,,,,,,,,,,,,,,,,,,,,,,,,,,,,,,,,,,,,,,,,,,,,,,,,,,,,,,,,,,,,,,,,,,,,,,,,,,,,,,,,,,,,,,,,,,,,,,,,,,,,,,,,,,,,,,,,,,,,,,,,,,,,,,,,,,,,,,,,,,,,,,,,,,,,,,,,,,,,,,,,,,,,,,,,,,,,,,,,,,,,,,,,,,,,,,,,,,,,,,,,,,Disrupting Weapons (1st level),,,,,,,,,,,,,,,,,,,,,,,,,,,,,,,,,,,,,,,,,,,,,,,,,,
Magic Fang,"One of your unarmed attacks shines with primal energy. The unarmed attack becomes a +1 striking unarmed attack, gaining a +1 item bonus to attack rolls and increasing the number of damage dice to two if it had only one.",Attacks,spells,,,,,,,TRUE,"One of your unarmed attacks becomes a +1 striking unarmed attack, gaining a +1 item bonus to attack rolls and increasing the number of damage dice to two if it had only one.",,,,,,,,,,,,,,,,,,,,,,,,,,,,,,,,,,,,,,,,,,,,,,,,,,,,,,,,,,,,,,,,,,,,,,,,,,,,,,,,,,,,,,,,,,,,,,,,,,,,,,,,,,,,,,,,,,,,,,,,,,,,,,,,,,,,,,,,,,,,,,,,,,,,,,,,,,,,,,,,,,,,,,,,,,,,,,,,,,,,,,,,,,,,,,,,,,,,,,,,,,,,,,,,,,,,,,,,,,,,,,,,,,,,,,,,,,,,,,,,,,,,,,,,,,,,,,,,,,
Pass without Trace,"You obscure the tracks you leave behind and make it harder for others to find you. The DC of checks to Track you gains a +4 status bonus or is equal to your spell DC, whichever results in a higher DC. You can benefit from only one pass without trace spell at a time.",Movement,spells,,,,,,,TRUE,"You obscure the tracks you leave behind and make it harder for others to find you. The DC of checks to Track you gains a +4 status bonus or is equal to your spell DC, whichever results in a higher DC. You can benefit from only one pass without trace spell at a time.",,,,,,,,,,,,,,,,,,,,,,,,,,,,,,,,,,,,,,,,,,,,,,,,,,,,,,,,,,,,,,,,,,,,,,,,,,,,,,,,,,,,,,,,,,,,,,,,,,,,,,,,,,,,,,,,,,,,,,,,,,,,,,,,,,,,,,,,,,,,,,,,,,,,,,,,,,,,,,,,,,,,,,,,,,,,,,,,,,,,,,,,,,,,,,,,,,,,,,,,,,,,,,,,,,,,,,,,,,,,,,,,,,,,,,,,,,,,,,,,,,,,,,,,,,,,,,,,,,
Shillelagh,"One non-magical club or staff you hold becomes a +1 striking weapon while in your hands, gaining a +1 item bonus to attack rolls and increasing the number of weapon damage dice to two. Additionally, as long as you are on your home plane, attacks you make with the target against aberrations, extraplanar creatures, and undead increase the number of weapon damage dice to three.",Attacks,spells,,,,,,,TRUE,"One non-magical club or staff you hold becomes a +1 striking weapon while in your hands, gaining a +1 item bonus to attack rolls and increasing the number of weapon damage dice to two. Additionally, as long as you are on your home plane, attacks you make with the target against aberrations, extraplanar creatures, and undead increase the number of weapon damage dice to three.",,,,,,,,,,,,,,,,,,,,,,,,,,,,,,,,,,,,,,,,,,,,,,,,,,,,,,,,,,,,,,,,,,,,,,,,,,,,,,,,,,,,,,,,,,,,,,,,,,,,,,,,,,,,,,,,,,,,,,,,,,,,,,,,,,,,,,,,,,,,,,,,,,,,,,,,,,,,,,,,,,,,,,,,,,,,,,,,,,,,,,,,,,,,,,,,,,,,,,,,,,,,,,,,,,,,,,,,,,,,,,,,,,,,,,,,,,,,,,,,,,,,,,,,,,,,,,,,,,
Hero's Defiance Cooldown,"Cheating death is difficult, and you can't use hero's defiance again until you Refocus or the next time you prepare.",,spells,,,,,,,,,,,,,,,,,,,,,,,,,,,,,,,,,,,,,,,,,,,,,,,,,,,,,,,,,,,,,,,,,,,,,,,,,,,,,,,,,,,,,,,,,,,,,,,,,,,,,,,,,,,,,,,,,,,,,,,,,,,,,,,,,,,,,,,,,,,,,,,,,,,,,,,,,,,,,,,,,,,,,,,,,,,,,,,,,,,,,,,,,,,,,,,,,,,,,,,,,,,,,,,,,,,,,,,,,,,,,,,,,,,,,,,,,,,,,,,,,,,,,,,,,,,,,,,,,,,,,,,,,,
Shifting Form,"You gain one of the following abilities of your choice. You can Dismiss this spell.

You gain a 20-foot status bonus to your Speed.
You gain a climb or swim Speed equal to half your Speed.
You gain darkvision.
You gain scent 60 feet (imprecise).",,spells,,,,Land Speed,status,Choice == 'Speed Bonus' ? 20 : 0,TRUE,,,,,,,,,,Climb Speed,,,,Swim Speed,,,,,,,,,"Choice == 'Climb Speed' ? Math.max(Math.floor(Speed('Land Speed') / 2 / 5) * 5, 5) : null","Choice == 'Swim Speed' ? Math.max(Math.floor(Speed('Land Speed') / 2 / 5) * 5, 5) : null",Darkvision,Shifting Form Claws,weapons,,,,,,,,,,,,Scent 60 feet (imprecise),,,,,,,,,,,,,,,,,,,,,,,,,,,,,,,,,,,,,,,,,,,,,,,,,,,,,,,,,,,,,,,,,,,,,,,,,,,,,,,,,Speed Bonus,Speed Bonus,Climb Speed,Swim Speed,Darkvision,Claws,Scent,,,,,,,,,,,,,,,,,,,,,,,,Claws,,,,,,,,,,,,,,,,,,,,,,,,,,,,,,,,,,,,,,,,,,,,,,,,,,,,,,,,,,,,,Darkvision,Scent,,,,,,,,,,,,,,,,,,,,,,,,,,,,,,,,,,,,,,,,,,,,,,,
Enlarge (2nd level),"Bolstered by magical power, you grow to size Large. Your equipment grows with you but returns to natural size if removed. You are clumsy 1. Your reach increases by 5 feet (or by 10 feet if you started out Tiny), and you gain a +2 status bonus to melee damage.",Attacks,spells,,,,Size,,,TRUE,Your reach increases by 5 feet (or by 10 feet if you started out Tiny).,,Clumsy,,,,,,,Melee Damage,2,1,,Reach,,5,,,,,,1,,,,,,,,,,,,,,,,,,,,,,,,,,,,,,,,,,,,,,,,,,,,,,,,,,,,,,,,,,,,,,,,,,,,,,,,,,,,,,,,,,,,,,,,,,,,,,,,,,,,,,,,,,,,,,,,,,,,,,,,,,,,,,,,,,,,,,,,,,,,,,,,,,,,,,,,,,,,,,,,,,,,,,,,,,,,,,,,,,,,,,,,,,,,,,,,,,,,,,,,,,,,,,,,,,,,,,,,,,,,,,,,,,,,,,,,,,,,,
Enlarge (4th level),"Bolstered by magical power, you grow to size Huge. Your equipment grows with you but returns to natural size if removed. You are clumsy 1. Your reach increases by 10 feet (or by 15 feet if you started out Tiny), and you gain a +4 status bonus to melee damage.",Attacks,spells,Enlarge (2nd level),,,Size,,,TRUE,Your reach increases by 10 feet (or by 15 feet if you started out Tiny).,,Clumsy,,,,,,,Melee Damage,4,1,,,,,,,,,,2,,,,,,,,,,,,,,,,,,,,,,,,,,,,,,,,,,,,,,,,,,,,,,,,,,,,,,,,,,,,,,,,,,,,,,,,,,,,,,,,,,,,,,,,,,,,,,,,,,,,,,,,,,,,,,,,,,,,,,,,,,,,,,,,,,,,,,,,,,,,,,,,,,,,,,,,,,,,,,,,,,,,,,,,,,,,,,,,,,,,,,,,,,,,,,,,,,,,,,,,,,,,,,,,,,,,,,,,,,,,,,,,,,,,,,,,,,,,,
Invisibility (2nd level),"Cloaked in illusion, you become invisible. If you use a hostile action, the spell ends after that hostile action is completed.",,spells,,,,,,,TRUE,,"If you use a hostile action, the spell ends after that hostile action is completed.",Invisible,,,,,,,,,,,,,,,,,,,,,,,,,,,,,,,,,,,,,,,,,,,,,,,,,,,,,,,,,,,,,,,,,,,,,,,,,,,,,,,,,,,,,,,,,,,,,,,,,,,,,,,,,,,,,,,,,,,,,,,,,,,,,,,,,,,,,,,,,,,,,,,,,,,,,,,,,,,,,,,,,,,,,,,,,,,,,,,,,,,,,,,,,,,,,,,,,,,,,,,,,,,,,,,,,,,,,,,,,,,,,,,,,,,,,,,,,,,,,,,,,,,,,,,,,,,,,,,,
Invisibility (4th level),"Cloaked in illusion, you become invisible. The spell doesn't end if you use a hostile action.",,spells,Invisibility (2nd level),,,,,,TRUE,,,Invisible,,,,,,,,,,,,,,,,,,,,,,,,,,,,,,,,,,,,,,,,,,,,,,,,,,,,,,,,,,,,,,,,,,,,,,,,,,,,,,,,,,,,,,,,,,,,,,,,,,,,,,,,,,,,,,,,,,,,,,,,,,,,,,,,,,,,,,,,,,,,,,,,,,,,,,,,,,,,,,,,,,,,,,,,,,,,,,,,,,,,,,,,,,,,,,,,,,,,,,,,,,,,,,,,,,,,,,,,,,,,,,,,,,,,,,,,,,,,,,,,,,,,,,,,,,,,,,,,
Blur,"Your form appears blurry. You become concealed. As the nature of this effect still leaves your location obvious, your can't use this concealment to Hide or Sneak.",,spells,,,,,,,TRUE,,,Concealed,,,,,,,,,,,,,,,,,,,,,,,,,,,,,,,,,,,,,,,,,,,,,,,,,,,,,,,,,,,,,,,,,,,,,,,,,,,,,,,,,,,,,,,,,,,,,,,,,,,,,,,,,,,,,,,,,,,,,,,,,,,,,,,,,,,,,,,,,,,,,,,,,,,,,,,,,,,,,,,,,,,,,,,,,,,,,,,,,,,,,,,,,,,,,,,,,,,,,,,,,,,,,,,,,,,,,,,,,,,,,,,,,,,,,,,,,,,,,,,,,,,,,,,,,,,,,,,,
