name,Blinded,Broken,Clumsy,Concealed,Confused,Controlled,Dazzled,Deafened,Dead,Doomed,Drained,Dying,Encumbered,Enfeebled,Fascinated,Fatigued,Flat-Footed,Fleeing,Friendly,Frightened,Grabbed,Helpful,Hidden,Hostile,Immobilized,Indifferent,Invisible,Observed,Paralyzed,Persistent Damage,Petrified,Prone,Quickened,Restrained,Sickened,Slowed,Stunned,Stupefied,Unconscious,Undetected,Unfriendly,Unnoticed,Wounded,Candle of Truth,Slippers of Spider Climbing,Eye of the Arclords,Crane Stance,Dragon Stance,Mountain Stance,Rain of Embers Stance,Tiger Stance,Wolf Stance,Mountain Stronghold,Ironblood Stance,Tangled Forest Stance,Wild Winds Stance,Wind Jump (5th level),Wind Jump (6th level),Ironblood Surge,Ethereal Jaunt,Barding of the Zephyr,Feather Fall,Air Bubble,Elemental Blood Magic,Speak with Animals,Call on Ancient Blood: Fortitude,Call on Ancient Blood: Reflex,Call on Ancient Blood: Will,Bracelets of Dashing,Collar of Empathy,Pest Form,Chameleon Gnome,Unseen Lizardfolk,Rage,Inspire Courage,Quivering Palm Immunity,Dancing Lights,Ghost Sound,Light,Mage Hand,Prestidigitation,Forbidding Ward (1st level),Forbidding Ward (6th level),Guidance,Guidance Immunity,Join Pasts,Alarm (1st level),Alarm (3rd level),Ant Haul,Anticipate Peril (1st level),Anticipate Peril (3rd level),Anticipate Peril (5th level),Anticipate Peril (7th level),Bane (Caster),Bane,Bless (Caster),Bless,Endure,Fleet Step,Floating Disk,Grease,Gust of Wind,Agitate,Command (failure),Command (critical failure),Ill Omen (failure),Ill Omen (critical failure),Illusory Disguise (1st level),Illusory Disguise (2nd level),Illusory Disguise (3rd level),Illusory Object (1st level),Illusory Object (2nd level),Illusory Object (5th level),Item Facade,Jump,Lock,Longstrider,Magic Aura (1st level),Magic Aura (3rd level),Magic Weapon,Message Rune,Imprint Message,Negate Aroma,Penumbral Shroud,Personal Rain Cloud,Phantom Pain (Failure),Phantom Pain (Critical Failure),Protection,Sanctuary,Scouring Sand (1st level),Scouring Sand (3rd level),Share Lore (1st level),Share Lore (5th level),Shattering Gem,Soothe,Spirit Link (Caster),Spirit Link,Summon Animal,Summon Construct,Summon Plant or Fungus,Summon Fey,Temporary Tool,Tether (Caster),True Strike,Unseen Servant,Ventriloquism (1st level),Ventriloquism (2nd level),Stabilize,Disrupting Weapons (1st level),Disrupting Weapons (3rd level),Disrupting Weapons (5th level),Magic Fang,Pass without Trace,Shillelagh,Hero's Defiance Cooldown,Shifting Form (Speed bonus),Shifting Form (climb Speed),Shifting Form (swim Speed),Shifting Form (darkvision),Shifting Form (scent),Enlarge (2nd level),Enlarge (4th level),Invisibility (2nd level),Invisibility (4th level),Blur,Haste,Invisibility Sphere,Wall of Fire,Dimension Door Immunity,Shrink,Levitate (Caster),Levitate,Mirror Image,Fly,Creation (4th level),Creation (5th level),Physical Boost,Darkvision Elixir,Potion of Flying,Mind Blank,True Seeing,Barkskin,Water Breathing,Potion of Acid Resistance,Potion of Cold Resistance,Potion of Electricity Resistance,Potion of Fire Resistance,Potion of Sonic Resistance,Truth Potion,Potion of Swimming,Shrinking Potion (Greater),Potion of Tongues,Black Dragon's Breath Potion (Young),Copper Dragon's Breath Potion (Young),Blue Dragon's Breath Potion (Young),Bronze Dragon's Breath Potion (Young),Brass Dragon's Breath Potion (Young),Green Dragon's Breath Potion (Young),Gold Dragon's Breath Potion (Young),Red Dragon's Breath Potion (Young),Silver Dragon's Breath Potion (Young),White Dragon's Breath Potion (Young),Black Dragon's Breath Potion (Adult),Copper Dragon's Breath Potion (Adult),Blue Dragon's Breath Potion (Adult),Bronze Dragon's Breath Potion (Adult),Brass Dragon's Breath Potion (Adult),Green Dragon's Breath Potion (Adult),Gold Dragon's Breath Potion (Adult),Red Dragon's Breath Potion (Adult),Silver Dragon's Breath Potion (Adult),White Dragon's Breath Potion (Adult),Black Dragon's Breath Potion (Wyrm),Copper Dragon's Breath Potion (Wyrm),Blue Dragon's Breath Potion (Wyrm),Bronze Dragon's Breath Potion (Wyrm),Brass Dragon's Breath Potion (Wyrm),Green Dragon's Breath Potion (Wyrm),Gold Dragon's Breath Potion (Wyrm),Red Dragon's Breath Potion (Wyrm),Silver Dragon's Breath Potion (Wyrm),White Dragon's Breath Potion (Wyrm),Lastwall Soup,Antidote (Lesser),Antidote (Moderate),Antidote (Greater),Antidote (Major),Antiplague (Lesser),Antiplague (Moderate),Antiplague (Greater),Antiplague (Major),Cheetah's Elixir,Elixir of Life (Minor),Elixir of Life (Lesser),Elixir of Life (Moderate),Elixir of Life (Greater),Elixir of Life (Major),Elixir of Life (True),Serene Mutagen (Lesser),Serene Mutagen (Moderate),Serene Mutagen (Greater),Serene Mutagen (Major),Silvertongue Mutagen,Bestial Mutagen,Cognitive Mutagen (Lesser),Cognitive Mutagen (Moderate),Cognitive Mutagen (Greater),Cognitive Mutagen (Major),Quicksilver Mutagen,Eagle-Eye Elixir,Eagle-Eye Elixir (Major),Juggernaut Mutagen (Lesser),Juggernaut Mutagen (Moderate),Juggernaut Mutagen (Greater),Juggernaut Mutagen (Major),Leaper's Elixir (Lesser),Leaper's Elixir (Greater),"Energy Mutagen (Acid, Lesser)","Energy Mutagen (Cold, Lesser)","Energy Mutagen (Electricity, Lesser)","Energy Mutagen (Fire, Lesser)","Energy Mutagen (Acid, Moderate)","Energy Mutagen (Cold, Moderate)","Energy Mutagen (Electricity, Moderate)","Energy Mutagen (Fire, Moderate)","Energy Mutagen (Acid, Greater)","Energy Mutagen (Cold, Greater)","Energy Mutagen (Electricity, Greater)","Energy Mutagen (Fire, Greater)","Energy Mutagen (Acid, Major)","Energy Mutagen (Cold, Major)","Energy Mutagen (Electricity, Major)","Energy Mutagen (Fire, Major)",Energy Mutagen Discharge,Infiltrator's Elixir,Bravo's Brew,Bravo's Brew (Greater),Cat's Eye Elixir,Comprehension Elixir,Stone Fist Elixir,Bomber's Eye Elixir (Lesser),Bomber's Eye Elixir (Greater),Winter Wolf Elixir (Lesser),Winter Wolf Elixir (Moderate),Winter Wolf Elixir (Greater),Salamander Elixir (Lesser),Salamander Elixir (Moderate),Salamander Elixir (Greater),Mistform Elixir,Sea Touch Elixir (Lesser),Sea Touch Elixir,Stone Body Mutagen,Elixir of Rejuvenation,Glamered Rune,Sinister Knight Rune,Snake Oil,Smokestick (Lesser),Sunrod,Silversheen,Smokestick (Greater),Purple Worm Repellent,Azure Worm Repellent,Crimson Worm Repellent,Arsenic (Onset),Arsenic (Stage 1),Arsenic (Stage 2),Arsenic (Stage 3),Viper Arrow,Everstand Stance,Point-Blank Shot,Dueling Parry,Twin Parry,Disarming Stance,Impassable Wall Stance,Mobile Shot Stance,Disruptive Stance,Lunging Stance,Paragon's Guard,Graceful Poise,Multishot Stance,Quickened (Weapon Supremacy),Quickened (Enduring Quickness),Favored Terrain: Aquatic,Favored Terrain: Arctic,Favored Terrain: Desert,Favored Terrain: Forest,Favored Terrain: Mountain,Favored Terrain: Plains,Favored Terrain: Sky,Favored Terrain: Swamp,Favored Terrain: Underground,Terrain Master,Hunt Prey: Flurry,Hunt Prey: Outwit,Hunt Prey: Precision,Badger Rage,Augment Summoning,Charming Words,Diviner's Sight,Protective Ward,Warped Terrain,Clairvoyance,Dread Aura,Verdant Sprout,Bespell Weapon (Abjuration),Bespell Weapon (Conjuration or Transmutation),"Bespell Weapon (Divination, Enchantment or Illusion)",Bespell Weapon (Evocation),Bespell Weapon (Necromancy),Bond Conservation,Magic Sense,Black Adder Venom (Stage 1),Black Adder Venom (Stage 2),Black Adder Venom (Stage 3),Cognitive Loophole,Mislead,Perfect Distraction,Perfect Distraction Exhaustion,Hidden Paragon,Inspire Competence,Potency Crystal,Jade Cat,Effervescent Ampoule,Onyx Panther,Feather Step Stone,Snapleaf,Dragon Turtle Scale,Sneaky Key,Tiger Menuki,Jade Bauble,Iron Medallion,Mummified Bat,Animal Form (2nd level),Animal Form (3rd level),Animal Form (4th level),Animal Form (5th level),Animal Messenger,Animus Mine,Breath of Drought,Calm Emotions,Comprehend Language,Continual Flame,Darkness,Darkvision,Death Knell,Endure Elements (2nd level),Endure Elements (3rd level),Endure Elements (5th level),Enhance Victuals,Entangle,Faerie Fire,False Life,Feast of Ashes (Failure),Feast of Ashes (Critical Failure),Flaming Sphere,Fungal Hyphae (2nd level),Fungal Hyphae (4th level),Fungal Hyphae (6th level),Ghoul Fever (Stage 1),Ghoul Fever (Stage 2),Ghoul Fever (Stage 3),Ghoul Fever (Stage 4),Ghoul Fever (Stage 5),Spider Venom (Stage 1),Spider Venom (Stage 2),Invisibility Negation,Hideous Laughter,Humanoid Form (2nd level),Humanoid Form (3rd level),,,,,,,,,,,,
type,generic,generic,generic,generic,generic,generic,generic,generic,generic,generic,generic,generic,generic,generic,generic,generic,generic,generic,generic,generic,generic,generic,generic,generic,generic,generic,generic,generic,generic,generic,generic,generic,generic,generic,generic,generic,generic,generic,generic,generic,generic,generic,generic,otherconsumables,wornitems,activities,activities,activities,activities,activities,activities,activities,activities,activities,activities,spells,spells,spells,activities,spells,wornitems,spells,spells,bloodmagic,spells,activities,activities,activities,wornitems,wornitems,spells,activities,activities,activities,spells,spells,spells,spells,spells,spells,spells,spells,spells,spells,spells,spells,spells,spells,spells,spells,spells,spells,spells,spells,spells,spells,spells,spells,spells,spells,spells,spells,spells,spells,spells,spells,spells,spells,spells,spells,spells,spells,spells,spells,spells,spells,spells,spells,spells,spells,spells,spells,spells,spells,spells,spells,spells,spells,spells,spells,spells,spells,spells,spells,spells,spells,spells,spells,spells,spells,spells,spells,spells,spells,spells,spells,spells,spells,spells,spells,spells,spells,spells,spells,spells,spells,spells,spells,spells,spells,spells,spells,spells,spells,spells,spells,spells,spells,spells,spells,spells,spells,spells,spells,spells,spells,spells,alchemicalelixirs,spells,spells,spells,spells,spells,potions,potions,potions,potions,potions,potions,potions,potions,potions,potions,potions,potions,potions,potions,potions,potions,potions,potions,potions,potions,potions,potions,potions,potions,potions,potions,potions,potions,potions,potions,potions,potions,potions,potions,potions,potions,potions,potions,potions,alchemicalelixirs,alchemicalelixirs,alchemicalelixirs,alchemicalelixirs,alchemicalelixirs,alchemicalelixirs,alchemicalelixirs,alchemicalelixirs,alchemicalelixirs,alchemicalelixirs,alchemicalelixirs,alchemicalelixirs,alchemicalelixirs,alchemicalelixirs,alchemicalelixirs,alchemicalelixirs,alchemicalelixirs,alchemicalelixirs,alchemicalelixirs,alchemicalelixirs,alchemicalelixirs,alchemicalelixirs,alchemicalelixirs,alchemicalelixirs,alchemicalelixirs,alchemicalelixirs,alchemicalelixirs,alchemicalelixirs,alchemicalelixirs,alchemicalelixirs,alchemicalelixirs,alchemicalelixirs,alchemicalelixirs,alchemicalelixirs,alchemicalelixirs,alchemicalelixirs,alchemicalelixirs,alchemicalelixirs,alchemicalelixirs,alchemicalelixirs,alchemicalelixirs,alchemicalelixirs,alchemicalelixirs,alchemicalelixirs,alchemicalelixirs,alchemicalelixirs,alchemicalelixirs,alchemicalelixirs,alchemicalelixirs,alchemicalelixirs,alchemicalelixirs,hidden,alchemicalelixirs,alchemicalelixirs,alchemicalelixirs,alchemicalelixirs,alchemicalelixirs,alchemicalelixirs,alchemicalelixirs,alchemicalelixirs,alchemicalelixirs,alchemicalelixirs,alchemicalelixirs,alchemicalelixirs,alchemicalelixirs,alchemicalelixirs,alchemicalelixirs,alchemicalelixirs,alchemicalelixirs,alchemicalelixirs,hidden,activities,activities,alchemicaltools,alchemicaltools,alchemicaltools,activities,alchemicaltools,activities,activities,activities,afflictions,hidden,hidden,hidden,ammunition,activities,activities,activities,activities,activities,activities,activities,activities,activities,activities,activities,activities,feats,feats,activities,activities,activities,activities,activities,activities,activities,activities,activities,activities,activities,activities,activities,activities,spells,spells,spells,spells,spells,spells,spells,spells,spells,spells,spells,spells,spells,activities,activities,afflictions,hidden,hidden,activities,spells,activities,hidden,activities,spells,talismans,talismans,talismans,talismans,talismans,talismans,talismans,talismans,talismans,talismans,talismans,talismans,spells,spells,spells,spells,spells,spells,spells,spells,spells,spells,spells,spells,spells,spells,spells,spells,spells,spells,spells,spells,spells,spells,spells,spells,spells,spells,afflictions,afflictions,afflictions,hidden,hidden,afflictions,afflictions,spells,spells,spells,spells,spells,spells,spells,spells,spells,spells,spells,spells,spells,spells,spells,spells
desc,"You can't see. All normal terrain is difficult terrain to you. You can't detect anything using vision. You automatically critically fail Perception checks that require you to be able to see, and if vision is your only precise sense, you take a -4 status penalty to Perception checks. You are immune to visual effects. Blinded overrides dazzled.","Broken is a condition that affects objects. An object is broken when damage has reduced its Hit Points to equal or less than its Broken Threshold. A broken object can't be used for its normal function, nor does it grant bonuses-with the exception of armor. Broken armor still grants its item bonus to AC, but it also imparts a status penalty to AC depending on its category: -1 for broken light armor, -2 for broken medium armor, or -3 for broken heavy armor.

A broken item still imposes penalties and limitations normally incurred by carrying, holding, or wearing it. For example, broken armor would still impose its Dexterity modifier cap, check penalty, and so forth.

If an effect makes an item broken automatically and the item has more HP than its Broken Threshold, that effect also reduces the item's current HP to the Broken Threshold.","Your movements become clumsy and inexact. Clumsy always includes a value. You take a status penalty equal to the condition value to Dexterity-based checks and DCs, including AC, Reflex saves, ranged attack rolls, and skill checks using Acrobatics, Stealth, and Thievery.","While you are concealed from a creature, such as in a thick fog, you are difficult for that creature to see. You can still be observed, but you're tougher to target. A creature that you're concealed from must succeed at a DC 5 flat check when targeting you with an attack, spell, or other effect. Area effects aren't subject to this flat check. If the check fails, the attack, spell, or effect doesn't affect you.","You don't have your wits about you, and you attack wildly. You are flat-footed, you don't treat anyone as your ally (though they might still treat you as theirs), and you can't Delay, Ready, or use reactions.

You use all your actions to Strike or cast offensive cantrips, though the GM can have you use other actions to facilitate attack, such as draw a weapon, move so that a target is in reach, and so forth. Your targets are determined randomly by the GM. If you have no other viable targets, you target yourself, automatically hitting but not scoring a critical hit. If it's impossible for you to attack or cast spells, you babble incoherently, wasting your actions.

Each time you take damage from an attack or spell, you can attempt a DC 11 flat check to recover from your confusion and end the condition.","Someone else is making your decisions for you, usually because you're being commanded or magically dominated. The controller dictates how you act and can make you use any of your actions, including attacks, reactions, or even Delay. The controller usually does not have to spend their own actions when controlling you.","Your eyes are overstimulated. If vision is your only precise sense, all creatures and objects are concealed from you.","You can't hear. You automatically critically fail Perception checks that require you to be able to hear. You take a -2 status penalty to Perception checks for initiative and checks that involve sound but also rely on other senses. If you perform an action with the auditory trait, you must succeed at a DC 5 flat check or the action is lost; attempt the check after spending the action but before any effects are applied. You are immune to auditory effects. ","You are dead. After you die, you can't act or be affected by spells that target creatures (unless they specifically target dead creatures), and for all other purposes you are an object. When you die, you are reduced to 0 Hit Points if you had a different amount, and you can't be brought above 0 Hit Points as long as you remain dead. Some magic can bring creatures back to life, such as the resurrect ritual or the raise dead spell.","A powerful force has gripped your soul, calling you closer to death. Doomed always includes a value. The dying value at which you die is reduced by your doomed value. If your maximum dying value is reduced to 0, you instantly die. When you die, you're no longer doomed.

Your doomed value decreases by 1 each time you get a full night's rest.","When a creature successfully drains you of blood or life force, you become less healthy. Drained always includes a value. You take a status penalty equal to your drained value on Constitution-based checks, such as Fortitude saves. You also lose a number of Hit Points equal to your level (minimum 1) times the drained value, and your maximum Hit Points are reduced by the same amount. For example, if you're hit by an effect that inflicts drained 3 and you're a 3rd-level character, you lose 9 Hit Points and reduce your maximum Hit Points by 9. Losing these Hit Points doesn't count as taking damage.

Each time you get a full night's rest, your drained value decreases by 1. This increases your maximum Hit Points, but you don't immediately recover the lost Hit Points.","You are bleeding out or otherwise at death's door. While you have this condition, you are unconscious. Dying always includes a value. If this value ever reaches dying 4, you die. If you're dying, you must attempt a recovery check at the start of your turn each round to determine whether you get better or worse.

If you lose the dying condition by succeeding at a recovery check and are still at 0 Hit Points, you remain unconscious, but you can wake up as described on page 460. You lose the dying condition automatically and wake up if you ever have 1 Hit Point or more. Anytime you lose the dying condition, you gain the wounded 1 condition, or increase your wounded value by 1 if you already have that condition.","You are carrying more weight than you can manage. While you're encumbered, you're clumsy 1 and take a 10-foot penalty to all your Speeds. As with all penalties to your Speed, this can't reduce your Speed below 5 feet.","You're physically weakened. Enfeebled always includes a value. When you are enfeebled, you take a status penalty equal to the condition value to Strength-based rolls and DCs, including Strength-based melee attack rolls, Strength-based damage rolls, and Athletics checks.","You are compelled to focus your attention on something, distracting you from whatever else is going on around you. You take a -2 status penalty to Perception and skill checks, and you can't use actions with the concentrate trait unless they or their intended consequences are related to the subject of your fascination (as determined by the GM). For instance, you might be able to Seek and Recall Knowledge about the subject, but you likely couldn't cast a spell targeting a different creature. This condition ends if a creature uses hostile actions against you or any of your allies.","You're tired and can't summon much energy. You take a -1 status penalty to AC and saving throws. While exploring, you can't choose an exploration activity.

You recover from fatigue after a full night's rest.","You're distracted or otherwise unable to focus your full attention on defense. You take a -2 circumstance penalty to AC. Some effects give you the flat-footed condition only to certain creatures or against certain attacks. Others - especially conditions - can make you universally flat-footed against everything. If a rule doesn't specify that the condition applies only to certain circumstances, it applies to all of them; for example, many effects simply say ""The target is flat-footed.""","You're forced to run away due to fear or some other compulsion. On your turn, you must spend each of your actions trying to escape the source of the fleeing condition as expediently as possible (such as by using move actions to flee, or opening doors barring your escape). The source is usually the effect or caster that gave you the condition, though some effects might define something else as the source. You can't Delay or Ready while fleeing.","This condition reflects a creature's disposition toward a particular character, and only supernatural effects (like a spell) can impose these conditions on player characters. A creature that is friendly to a character likes that character. The character can attempt to make a Request of a friendly creature, and the friendly creature is likely to agree to a simple and safe request that doesn't cost it much to fulfill. If the character or one of their allies uses hostile actions against the creature, the creature gains a worse attitude condition depending on the severity of the hostile action, as determined by the GM.","You're gripped by fear and struggle to control your nerves. The frightened condition always includes a value. You take a status penalty equal to this value to all your checks and DCs. Unless specified otherwise, at the end of each of your turns, the value of your frightened condition decreases by 1.","You're held in place by another creature, giving you the flat-footed and immobilized conditions. If you attempt a manipulate action while grabbed, you must succeed at a DC 5 flat check or it is lost; roll the check after spending the action, but before any effects are applied.","This condition reflects a creature's disposition toward a particular character, and only supernatural effects (like a spell) can impose these conditions on player characters. A creature that is helpful to a character wishes to actively aid that character. It will accept reasonable Requests from that character, as long as such requests aren't at the expense of the helpful creature's goals or quality of life. If the character or one of their allies uses a hostile action against the creature, the creature gains a worse attitude condition depending on the severity of the hostile action, as determined by the GM.","While you're hidden from a creature, that creature knows the space you're in but can't tell precisely where you are. You typically become hidden by using Stealth to Hide. When Seeking a creature using only imprecise senses, it remains hidden, rather than observed. A creature you're hidden from is flat-footed to you, and it must succeed at a DC 11 flat check when targeting you with an attack, spell, or other effect or it fails affect you. Area effects aren't subject to this flat check.

