Bravo's Brew (Greater),"This flask of foaming beer grants courage. You gain an item bonus to Will saves equal to the value, which is greater by 1 when attempting Will saves against fear. If you roll a success on a save against fear, you get a critical success instead.",Will,alchemicalelixirs,Bravo's Brew,,TRUE,Will,item,Value,TRUE,"Your item bonus from Bravo's Brew is improved by 1 when attempting Will saves against fear. If you roll a success on a save against fear, you get a critical success instead.",,,,,,,,,,,,,,,,,,,,,,,,,,,,,,,,,,,,,,,,,,,,,,,,,,,,,,,,,,,,,,,,,,,,,,,,,,,,,,,,,,,,,,,,,,,,,,,,,,,,,,,,,,,,,,,,,,,,,,,,,,,,,,,,,,,,,,,,,,,,,,,,,,,,,,,,,,,,,,,,,,,,,,,,,,,,,,,,,,,,,,,,,,,,,,,,,,,,,,,,,,,,,,,,,,,,,,,,,,,,,,,,,,,,,,,,,,,,,,,,,,,,,,,,,,,,,,,,,,
Cat's Eye Elixir,"Your vision sharpens and you become sensitive to even the most minute movements. You reduce the flat check to target hidden creatures to 5, and you don't need to attempt a flat check to target concealed creatures. These benefits apply only against creatures within 30 feet of you. ",Perception,alchemicalelixirs,,,,,,,TRUE,"You reduce the flat check to target hidden creatures to 5, and you don't need to attempt a flat check to target concealed creatures. These benefits apply only against creatures within 30 feet of you. ",,,,,,,,,,,,,,,,,,,,,,,,,,,,,,,,,,,,,,,,,,,,,,,,,,,,,,,,,,,,,,,,,,,,,,,,,,,,,,,,,,,,,,,,,,,,,,,,,,,,,,,,,,,,,,,,,,,,,,,,,,,,,,,,,,,,,,,,,,,,,,,,,,,,,,,,,,,,,,,,,,,,,,,,,,,,,,,,,,,,,,,,,,,,,,,,,,,,,,,,,,,,,,,,,,,,,,,,,,,,,,,,,,,,,,,,,,,,,,,,,,,,,,,,,,,,,,,,,,
Comprehension Elixir,"You can understand any words you read, so long as they are written in a common language. This elixir doesn't automatically allow you to understand codes or extremely esoteric passages - you still need to attempt a skill check to Decipher Writing.",Languages,alchemicalelixirs,,,,,,,TRUE,"You can understand any words you read, so long as they are written in a common language. This elixir doesn't automatically allow you to understand codes or extremely esoteric passages - you still need to attempt a skill check to Decipher Writing.",,,,,,,,,,,,,,,,,,,,,,,,,,,,,,,,,,,,,,,,,,,,,,,,,,,,,,,,,,,,,,,,,,,,,,,,,,,,,,,,,,,,,,,,,,,,,,,,,,,,,,,,,,,,,,,,,,,,,,,,,,,,,,,,,,,,,,,,,,,,,,,,,,,,,,,,,,,,,,,,,,,,,,,,,,,,,,,,,,,,,,,,,,,,,,,,,,,,,,,,,,,,,,,,,,,,,,,,,,,,,,,,,,,,,,,,,,,,,,,,,,,,,,,,,,,,,,,,,,
Stone Fist Elixir,Your fists become hard as stone. They deal 1d6 bludgeoning damage and lose the nonlethal trait.,Fist,alchemicalelixirs,,,,Fist Dice Size,,,TRUE,Your fists lose the nonlethal trait. You do not take the -2 circumstance penalty to make a lethal attack with your fists.,,,,,,,,,,,,,,,,,,,,,6,,,,,,,,,,,,,,,,,,,,,,,,,,,,,,,,,,,,,,,,,,,,,,,,,,,,,,,,,,,,,,,,,,,,,,,,,,,,,,,,,,,,,,,,,,,,,,,,,,,,,,,,,,,,,,,,,,,,,,,,,,,,,,,,,,,,,,,,,,,,,,,,,,,,,,,,,,,,,,,,,,,,,,,,,,,,,,,,,,,,,,,,,,,,,,,,,,,,,,,,,,,,,,,,,,,,,,,,,,,,,,,,,,,,,,,,,,,,,
Bomber's Eye Elixir (Lesser),This tincture lets you pinpoint your foes. Your alchemical bomb Strikes reduce the circumstance bonus to AC your targets gain from cover.,"Alchemical Bomb, Attacks",alchemicalelixirs,,,,,,,TRUE,Your alchemical bomb Strikes reduce the circumstance bonus to AC your targets gain from cover by 1.,,,,,,,,,,,,,,,,,,,,,,,,,,,,,,,,,,,,,,,,,,,,,,,,,,,,,,,,,,,,,,,,,,,,,,,,,,,,,,,,,,,,,,,,,,,,,,,,,,,,,,,,,,,,,,,,,,,,,,,,,,,,,,,,,,,,,,,,,,,,,,,,,,,,,,,,,,,,,,,,,,,,,,,,,,,,,,,,,,,,,,,,,,,,,,,,,,,,,,,,,,,,,,,,,,,,,,,,,,,,,,,,,,,,,,,,,,,,,,,,,,,,,,,,,,,,,,,,,,
Bomber's Eye Elixir (Greater),This tincture lets you pinpoint your foes. Your alchemical bomb Strikes reduce the circumstance bonus to AC your targets gain from cover.,"Alchemical Bomb, Attacks",alchemicalelixirs,Bomber's Eye Elixir (Lesser),,,,,,TRUE,Your alchemical bomb Strikes reduce the circumstance bonus to AC your targets gain from cover by 2.,,,,,,,,,,,,,,,,,,,,,,,,,,,,,,,,,,,,,,,,,,,,,,,,,,,,,,,,,,,,,,,,,,,,,,,,,,,,,,,,,,,,,,,,,,,,,,,,,,,,,,,,,,,,,,,,,,,,,,,,,,,,,,,,,,,,,,,,,,,,,,,,,,,,,,,,,,,,,,,,,,,,,,,,,,,,,,,,,,,,,,,,,,,,,,,,,,,,,,,,,,,,,,,,,,,,,,,,,,,,,,,,,,,,,,,,,,,,,,,,,,,,,,,,,,,,,,,,,,
Winter Wolf Elixir (Lesser),This elixir warms your core and improves your circulation. You are protected from the effects of severe cold.,Resistances,alchemicalelixirs,,,,,,,TRUE,You are protected from the effects of severe cold.,,,,,,,,,,,,,,,,,,,,,,,,,,,,,,,,,,,,,,,,,,,,,,,,,,,,,,,,,,,,,,,,,,,,,,,,,,,,,,,,,,,,,,,,,,,,,,,,,,,,,,,,,,,,,,,,,,,,,,,,,,,,,,,,,,,,,,,,,,,,,,,,,,,,,,,,,,,,,,,,,,,,,,,,,,,,,,,,,,,,,,,,,,,,,,,,,,,,,,,,,,,,,,,,,,,,,,,,,,,,,,,,,,,,,,,,,,,,,,,,,,,,,,,,,,,,,,,,,,
Winter Wolf Elixir (Moderate),This elixir warms your core and improves your circulation. You are protected from the effects of severe and extreme cold.,Resistances,alchemicalelixirs,Winter Wolf Elixir (Lesser),,,,,,TRUE,You are protected from the effects of severe and extreme cold.,,,,,,,,,,,,,,,,,,,,,,,,,,,,,,,,,,,,,,,,,,,,,,,,,,,,,,,,,,,,,,,,,,,,,,,,,,,,,,,,,,,,,,,,,,,,,,,,,,,,,,,,,,,,,,,,,,,,,,,,,,,,,,,,,,,,,,,,,,,,,,,,,,,,,,,,,,,,,,,,,,,,,,,,,,,,,,,,,,,,,,,,,,,,,,,,,,,,,,,,,,,,,,,,,,,,,,,,,,,,,,,,,,,,,,,,,,,,,,,,,,,,,,,,,,,,,,,,,,
Winter Wolf Elixir (Greater),"This elixir warms your core and improves your circulation. You are protected from the effects of severe, extreme and incredible cold.",Resistances,alchemicalelixirs,Winter Wolf Elixir (Moderate),,,,,,TRUE,"You are protected from the effects of severe, extreme and incredible cold.",,,,,,,,,,,,,,,,,,,,,,,,,,,,,,,,,,,,,,,,,,,,,,,,,,,,,,,,,,,,,,,,,,,,,,,,,,,,,,,,,,,,,,,,,,,,,,,,,,,,,,,,,,,,,,,,,,,,,,,,,,,,,,,,,,,,,,,,,,,,,,,,,,,,,,,,,,,,,,,,,,,,,,,,,,,,,,,,,,,,,,,,,,,,,,,,,,,,,,,,,,,,,,,,Winter Wolf Elixir (Lesser),,,,,,,,,,,,,,,,,,,,,,,,,,,,,,,,,,,,,,,,,,,,,,,,,,
Salamander Elixir (Lesser),This elixir is made from salamander scales to withstand fire. You are protected from the effects of severe heat.,Resistances,alchemicalelixirs,,,,,,,TRUE,You are protected from the effects of severe heat.,,,,,,,,,,,,,,,,,,,,,,,,,,,,,,,,,,,,,,,,,,,,,,,,,,,,,,,,,,,,,,,,,,,,,,,,,,,,,,,,,,,,,,,,,,,,,,,,,,,,,,,,,,,,,,,,,,,,,,,,,,,,,,,,,,,,,,,,,,,,,,,,,,,,,,,,,,,,,,,,,,,,,,,,,,,,,,,,,,,,,,,,,,,,,,,,,,,,,,,,,,,,,,,,,,,,,,,,,,,,,,,,,,,,,,,,,,,,,,,,,,,,,,,,,,,,,,,,,,
Salamander Elixir (Moderate),This elixir is made from salamander scales to withstand fire. You are protected from the effects of severe and extreme heat.,Resistances,alchemicalelixirs,Salamander Elixir (Lesser),,,,,,TRUE,You are protected from the effects of severe and extreme heat.,,,,,,,,,,,,,,,,,,,,,,,,,,,,,,,,,,,,,,,,,,,,,,,,,,,,,,,,,,,,,,,,,,,,,,,,,,,,,,,,,,,,,,,,,,,,,,,,,,,,,,,,,,,,,,,,,,,,,,,,,,,,,,,,,,,,,,,,,,,,,,,,,,,,,,,,,,,,,,,,,,,,,,,,,,,,,,,,,,,,,,,,,,,,,,,,,,,,,,,,,,,,,,,,,,,,,,,,,,,,,,,,,,,,,,,,,,,,,,,,,,,,,,,,,,,,,,,,,,
Salamander Elixir (Greater),"This elixir is made from salamander scales to withstand fire. You are protected from the effects of severe, extreme and incredible heat.",Resistances,alchemicalelixirs,Salamander Elixir (Moderate),,,,,,TRUE,"You are protected from the effects of severe, extreme and incredible heat.",,,,,,,,,,,,,,,,,,,,,,,,,,,,,,,,,,,,,,,,,,,,,,,,,,,,,,,,,,,,,,,,,,,,,,,,,,,,,,,,,,,,,,,,,,,,,,,,,,,,,,,,,,,,,,,,,,,,,,,,,,,,,,,,,,,,,,,,,,,,,,,,,,,,,,,,,,,,,,,,,,,,,,,,,,,,,,,,,,,,,,,,,,,,,,,,,,,,,,,,,,,,,,,,Salamander Elixir (Lesser),,,,,,,,,,,,,,,,,,,,,,,,,,,,,,,,,,,,,,,,,,,,,,,,,,
Mistform Elixir,"A faint mist emanates from your skin, making you concealed for the duration. As usual being concealed when your position is still obvious, you can't use this concealment to Hide or Sneak.",,alchemicalelixirs,,,,,,,TRUE,,,Concealed,,,,,,,,,,,,,,,,,,,,,,,,,,,,,,,,,,,,,,,,,,,,,,,,,,,,,,,,,,,,,,,,,,,,,,,,,,,,,,,,,,,,,,,,,,,,,,,,,,,,,,,,,,,,,,,,,,,,,,,,,,,,,,,,,,,,,,,,,,,,,,,,,,,,,,,,,,,,,,,,,,,,,,,,,,,,,,,,,,,,,,,,,,,,,,,,,,,,,,,,,,,,,,,,,,,,,,,,,,,,,,,,,,,,,,,,,,,,,,,,,,,,,,,,,,,,,,,,
Sea Touch Elixir (Lesser),"This briny concoction alters the skin on your hands and feet. The spaces between your fingers and toes become webbed, granting you a swim Speed of 20 feet for the listed duration.",,alchemicalelixirs,,,,Swim Speed,,,TRUE,,,,,,,,,,,,,,,,,,,,,,20,,,,,,,,,,,,,,,,,,,,,,,,,,,,,,,,,,,,,,,,,,,,,,,,,,,,,,,,,,,,,,,,,,,,,,,,,,,,,,,,,,,,,,,,,,,,,,,,,,,,,,,,,,,,,,,,,,,,,,,,,,,,,,,,,,,,,,,,,,,,,,,,,,,,,,,,,,,,,,,,,,,,,,,,,,,,,,,,,,,,,,,,,,,,,,,,,,,,,,,,,,,,,,,,,,,,,,,,,,,,,,,,,,,,,,,,,,,,,
Sea Touch Elixir,"This briny concoction alters the skin on your hands and feet. The spaces between your fingers and toes become webbed, granting you a swim Speed of 20 feet for the listed duration. Addictionally, you can breathe underwater.","Health, Fortitude",alchemicalelixirs,,,,Swim Speed,,,TRUE,You can breathe underwater.,,,,,,,,,,,,,,,,,,,,,20,,,,,,,,,,,,,,,,,,,,,,,,,,,,,,,,,,,,,,,,,,,,,,,,,,,,,,,,,,,,,,,,,,,,,,,,,,,,,,,,,,,,,,,,,,,,,,,,,,,,,,,,,,,,,,,,,,,,,,,,,,,,,,,,,,,,,,,,,,,,,,,,,,,,,,,,,,,,,,,,,,,,,,,,,,,,,,,,,,,,,,,,,,,,,,,,,,,,,,,,,,,,,,,,,,,,,,,,,,,,,,,,,,,,,,,,,,,,,
Stone Body Mutagen,"This mutagen calcifies your body making it as hard as stone.

<strong>Benefit</strong> You gain resistance to physical damage (except bludgeoning) equal to the value * 5.
<strong>Drawback</strong> Your Speeds are reduced by 10 feet (minimum 5 feet) and you take a -2 penalty to Reflex saves.",,alchemicalelixirs,,,,Physical Damage Resistance (except Bludgeoning),,Value * 5,TRUE,,,,,,,,,,Speed,-10,,,Reflex,,-2,,,,,,,,,,,,,,,,,,,,,,,,,,,,,,,,,,,,,,,,,,,,,,,,,,,,,,,,,,,,,,,,,,,,,,,,,,,,,,,,,,,,,,,,,,,,,,,,,,,,,,,,,,,,,,,,,,,,,,,,,,,,,,,,,,,,,,,,,,,,,,,,,,,,,,,,,,,,,,,,,,,,,,,,,,,,,,,,,,,,,,,,,,,,,,,,,,,,,,,,,,,,,,,,,,,,,,,,,,,,,,,,,,,,,,,,,,,,,,,,,,,
Elixir of Rejuvenation,,,hidden,,,,,,,,,,,,,,Dead,Dying,,,,,,,,,,,,,,,,,,,,,,,,,,,,,,,,,,,,,,,,,,,,,,,,,,,,,,,,,,,,,,,,,,,,,,,,,,,,,,,,,,,,,,,,,,,,,,,,,,,,,,,,,,,,,,,,,,,,,,,,,,,,,,,,,,,,,,,,,,,,,,,,,,,,,,,,,,,,,,,,,,,,,,,,,,,,,,,,,,,,,,,,,,,,,,,,,,,,,,,,,,,,,,,,,,,,,,,,,,,,,,,,,,,,,,,,,,,,,,,,,,,,,,,,,,,
Glamered Rune,"Your armor appears as ordinary or fine clothes of your imagining. The armor's statistics do not change. Only a creature that is benefiting from true seeing or a similar effect can attempt to disbelieve this illusion, with a DC of 25.",Deception,activities,,,,,,,TRUE,"Your armor appears as ordinary or fine clothes of your imagining. The armor's statistics do not change. Only a creature that is benefiting from true seeing or a similar effect can attempt to disbelieve this illusion, with a DC of 25.",,,,,,,,,,,,,,,,,,,,,,,,,,,,,,,,,,,,,,,,,,,,,,,,,,,,,,,,,,,,,,,,,,,,,,,,,,,,,,,,,,,,,,,,,,,,,,,,,,,,,,,,,,,,,,,,,,,,,,,,,,,,,,,,,,,,,,,,,,,,,,,,,,,,,,,,,,,,,,,,,,,,,,,,,,,,,,,,,,,,,,,,,,,,,,,,,,,,,,,,,,,,,,,,,,,,,,,,,,,,,,,,,,,,,,,,,,,,,,,,,,,,,,,,,,,,,,,,,,
Sinister Knight Rune,"While the sinister knight armor's disguise is active, any identifying insignia or aesthetic of the armor is replaced by generic malevolent aesthetics such as spikes or demonic faces. While in the disguise, the wearer is always considered to be taking precautions against lifesense, and even a creature that successfully notices the wearer with its lifesense mistakes the wearer for an undead unless it critically succeeds at its Perception check or the wearer critically fails a Deception or Stealth check. Finally, while in the disguise, the rune attempts to counteract any effects that would reveal your alignment; on a successful counteract check, rather than negate the effect, the rune causes the effect to perceive your alignment as evil (maintaining any lawful or chaotic component of your alignment).

The wearer can Dismiss the disguise, and if the wearer's armor is removed, the disguise deactivates automatically.",,activities,,,,,,,TRUE,,,,,,,,,,,,,,,,,,,,,,,,,,,,,,,,,,,,,,,,,,,,,,,,,,,,,,,,,,,,,,,,,,,,,,,,,,,,,,,,,,,,,,,,,,,,,,,,,,,,,,,,,,,,,,,,,,,,,,,,,,,,,,,,,,,,,,,,,,,,,,,,,,,,,,,,,,,,,,,,,,,,,,,,,,,,,,,,,,,,,,,,,,,,,,,,,,,,,,,,,,,,,,,,,,,,,,,,,,,,,,,,,,,,,,,,,,,,,,,,,,,,,,,,,,,,,,,,,,,
Snake Oil,"You have snake oil applied onto a wound or other outward symptom of an affliction or condition (such as sores from a disease or discoloration from a poison). For the duration, the symptom disappears and you don't feel as if you still have the wound or affliction, though all effects remain. A creature can uncover the ruse by succeeding at a DC 17 Perception check, but only if it uses a Seek action to specifically examine the snake oil's effects.",,alchemicaltools,,,,,,,TRUE,,,,,,,,,,,,,,,,,,,,,,,,,,,,,,,,,,,,,,,,,,,,,,,,,,,,,,,,,,,,,,,,,,,,,,,,,,,,,,,,,,,,,,,,,,,,,,,,,,,,,,,,,,,,,,,,,,,,,,,,,,,,,,,,,,,,,,,,,,,,,,,,,,,,,,,,,,,,,,,,,,,,,,,,,,,,,,,,,,,,,,,,,,,,,,,,,,,,,,,,,,,,,,,,,,,,,,,,,,,,,,,,,,,,,,,,,,,,,,,,,,,,,,,,,,,,,,,,,,,
Smokestick (Lesser),"You have created a screen of thick, opaque smoke in a 5-foot burst centered on one corner of your space. All creatures within that area are concealed, and all other creatures are concealed to them. The smoke can be dispersed by a strong wind.",,alchemicaltools,,,,,,,TRUE,,,Concealed,,,,,,,,,,,,,,,,,,,,,,,,,,,,,,,,,,,,,,,,,,,,,,,,,,,,,,,,,,,,,,,,,,,,,,,,,,,,,,,,,,,,,,,,,,,,,,,,,,,,,,,,,,,,,,,,,,,,,,,,,,,,,,,,,,,,,,,,,,,,,,,,,,,,,,,,,,,,,,,,,,,,,,,,,,,,,,,,,,,,,,,,,,,,,,,,,,,,,,,,,,,,,,,,,,,,,,,,,,,,,,,,,,,,,,,,,,,,,,,,,,,,,,,,,,,,,,,,
Sunrod,The sunrod sheds bright light in a 20-foot radius (and dim light to the next 40 feet).,,alchemicaltools,,,,,,,TRUE,,,,,,,,,,,,,,,,,,,,,,,,,,,,,,,,,,,,,,,,,,,,,,,,,,,,,,,,,,,,,,,,,,,,,,,,,,,,,,,,,,,,,,,,,,,,,,,,,,,,,,,,,,,,,,,,,,,,,,,,,,,,,,,,,,,,,,,,,,,,,,,,,,,,,,,,,,,,,,,,,,,,,,,,,,,,,,,,,,,,,,,,,,,,,,,,,,,,,,,,,,,,,,,,,,,,,,,,,,,,,,,,,,,,,,,,,,,,,,,,,,,,,,,,,,,,,,,,,,,
Silversheen,"The melee weapon, thrown weapon, or 10 pieces of ammunition that you have slathered silversheen on count as silver instead of its normal precious material (such as cold iron) for any physical damage they deal.",Attacks,activities,,,,,,,TRUE,"One chosen melee weapon, thrown weapon, or 10 pieces of ammunition count as silver instead of its normal precious material (such as cold iron) for any physical damage they deal.",,,,,,,,,,,,,,,,,,,,,,,,,,,,,,,,,,,,,,,,,,,,,,,,,,,,,,,,,,,,,,,,,,,,,,,,,,,,,,,,,,,,,,,,,,,,,,,,,,,,,,,,,,,,,,,,,,,,,,,,,,,,,,,,,,,,,,,,,,,,,,,,,,,,,,,,,,,,,,,,,,,,,,,,,,,,,,,,,,,,,,,,,,,,,,,,,,,,,,,,,,,,,,,,,,,,,,,,,,,,,,,,,,,,,,,,,,,,,,,,,,,,,,,,,,,,,,,,,,
Smokestick (Greater),"You have created a screen of thick, opaque smoke in a 20-foot burst centered on one corner of your space. All creatures within that area are concealed, and all other creatures are concealed to them. The smoke can be dispersed by a strong wind.",,alchemicaltools,,,,,,,TRUE,,,Concealed,,,,,,,,,,,,,,,,,,,,,,,,,,,,,,,,,,,,,,,,,,,,,,,,,,,,,,,,,,,,,,,,,,,,,,,,,,,,,,,,,,,,,,,,,,,,,,,,,,,,,,,,,,,,,,,,,,,,,,,,,,,,,,,,,,,,,,,,,,,,,,,,,,,,,,,,,,,,,,,,,,,,,,,,,,,,,,,,,,,,,,,,,,,,,,,,,,,,,,,,,,,,,,,,,,,,,,,,,,,,,,,,,,,,,,,,,,,,,,,,,,,,,,,,,,,,,,,,
Purple Worm Repellent,"The repellent causes purple cave worms to avoid attacking you in melee as long as they have something else nearby to attack. The repellent does not deter a cave worm from making ranged attacks against you. If no creatures are within a cave worm's reach and it wants to approach and make a melee attack, it approaches and attacks a non-coated creature if it can without spending more actions to do so.

If you are swallowed by a purple cave worm, the cave worm must succeed at a Fortitude save or involuntarily regurgitate you on the next round (a single action).",,activities,,,,,,,TRUE,,,,,,,,,,,,,,,,,,,,,,,,,,,,,,,,,,,,,,,,,,,,,,,,,,,,,,,,,,,,,,,,,,,,,,,,,,,,,,,,,,,,,,,,,,,,,,,,,,,,,,,,,,,,,,,,,,,,,,,,,,,,,,,,,,,,,,,,,,,,,,,,,,,,,,,,,,,,,,,,,,,,,,,,,,,,,,,,,,,,,,,,,,,,,,,,,,,,,,,,,,,,,,,,,,,,,,,,,,,,,,,,,,,,,,,,,,,,,,,,,,,,,,,,,,,,,,,,,,,
Azure Worm Repellent,"The repellent causes azure cave worms to avoid attacking you in melee as long as they have something else nearby to attack. The repellent does not deter a cave worm from making ranged attacks against you. If no creatures are within a cave worm's reach and it wants to approach and make a melee attack, it approaches and attacks a non-coated creature if it can without spending more actions to do so.

If you are swallowed by a azure cave worm, the cave worm must succeed at a Fortitude save or involuntarily regurgitate you on the next round (a single action).",,activities,,,,,,,TRUE,,,,,,,,,,,,,,,,,,,,,,,,,,,,,,,,,,,,,,,,,,,,,,,,,,,,,,,,,,,,,,,,,,,,,,,,,,,,,,,,,,,,,,,,,,,,,,,,,,,,,,,,,,,,,,,,,,,,,,,,,,,,,,,,,,,,,,,,,,,,,,,,,,,,,,,,,,,,,,,,,,,,,,,,,,,,,,,,,,,,,,,,,,,,,,,,,,,,,,,,,,,,,,,,,,,,,,,,,,,,,,,,,,,,,,,,,,,,,,,,,,,,,,,,,,,,,,,,,,,
Crimson Worm Repellent,"The repellent causes crimson cave worms to avoid attacking you in melee as long as they have something else nearby to attack. The repellent does not deter a cave worm from making ranged attacks against you. If no creatures are within a cave worm's reach and it wants to approach and make a melee attack, it approaches and attacks a non-coated creature if it can without spending more actions to do so.

If you are swallowed by a crimson cave worm, the cave worm must succeed at a Fortitude save or involuntarily regurgitate you on the next round (a single action).",,activities,,,,,,,TRUE,,,,,,,,,,,,,,,,,,,,,,,,,,,,,,,,,,,,,,,,,,,,,,,,,,,,,,,,,,,,,,,,,,,,,,,,,,,,,,,,,,,,,,,,,,,,,,,,,,,,,,,,,,,,,,,,,,,,,,,,,,,,,,,,,,,,,,,,,,,,,,,,,,,,,,,,,,,,,,,,,,,,,,,,,,,,,,,,,,,,,,,,,,,,,,,,,,,,,,,,,,,,,,,,,,,,,,,,,,,,,,,,,,,,,,,,,,,,,,,,,,,,,,,,,,,,,,,,,,,
Arsenic (Onset),"This toxin is a compound of arsenic and other substances. You can't reduce your sickened condition while affected.

<strong>Saving Throw</strong> DC 18 Fortitude
<var><strong>Onset</strong> 10 minutes</var>
<strong>Maximum Duration</strong> 5 minutes
<strong>Stage 1</strong> 1d4 poison damage and sickened 1 (1 minute)
<strong>Stage 2</strong> 1d6 poison damage and sickened 2 (1 minute)
<strong>Stage 3</strong> 2d6 poison damage and sickened 3 (1 minute)",,afflictions,,,,,,,,,,,,,,,,,,,,,,,,,,,,,,,,,,,,,,,,,,,,,,,,,,,,,,,,,,,,,,,,,,,,,,,,,,,,,,,,,,,,,,,,,,,,,,,,,,,,,,,,,,,,,,,,,,,,,,,,,,,,,,,,,,,,,,,,,,,,,,,,,,,,,,,,,,,,,,,,,,,,,,,,,,,,,,,,,,,,,,,,,,,,,,,,,,,,,,,,,,,,,,,,,,,,,,,,,,,,,,,,,,,,,,,,,,,500,TRUE,1000,Arsenic (Stage 1),,,,,,,,,,,,,,,,,,,,,,,,,,,,
Arsenic (Stage 1),"This toxin is a compound of arsenic and other substances. You can't reduce your sickened condition while affected.

<strong>Saving Throw</strong> DC 18 Fortitude
<strong>Onset</strong> 10 minutes
<strong>Maximum Duration</strong> 5 minutes
<var><strong>Stage 1</strong> 1d4 poison damage and sickened 1 (1 minute)</var>
<strong>Stage 2</strong> 1d6 poison damage and sickened 2 (1 minute)
<strong>Stage 3</strong> 2d6 poison damage and sickened 3 (1 minute)",,hidden,,,,,,,,,"Every time you reach this stage, take 1d4 poison damage.",Sickened,,,,,,,,,1,,,,,,,,,,,,,,,,,,,,,,,,,,,,,,,,,,,,,,,,,,,,,,,,,,,,,,,,,,,,,,,,,,,,,,,,,,,,,,,,,,,,,,,,,,,,,,,,,,,,,,,,,,,,,,,,,,,,,,,,,,,,,,,,,,,,,,,,,,,,,,,,,,,,,,,,,,,,,,,,,,,,,,,,,,,,,,,,,,,,,,,,,,,,,,,,,,,,,,,,,,,,,,,,,,,,,,,,,,100,Arsenic (Stage 2),,,,,,,,,,,,,,,,,,,,,,,,,,,,
Arsenic (Stage 2),"This toxin is a compound of arsenic and other substances. You can't reduce your sickened condition while affected.

<strong>Saving Throw</strong> DC 18 Fortitude
<strong>Onset</strong> 10 minutes
<strong>Maximum Duration</strong> 5 minutes
<strong>Stage 1</strong> 1d4 poison damage and sickened 1 (1 minute)
<var><strong>Stage 2</strong> 1d6 poison damage and sickened 2 (1 minute)</var>
<strong>Stage 3</strong> 2d6 poison damage and sickened 3 (1 minute)",,hidden,,,,,,,,,"Every time you reach this stage, take 1d6 poison damage.",Sickened,,,,,,,,,2,,,,,,,,,,,,,,,,,,,,,,,,,,,,,,,,,,,,,,,,,,,,,,,,,,,,,,,,,,,,,,,,,,,,,,,,,,,,,,,,,,,,,,,,,,,,,,,,,,,,,,,,,,,,,,,,,,,,,,,,,,,,,,,,,,,,,,,,,,,,,,,,,,,,,,,,,,,,,,,,,,,,,,,,,,,,,,,,,,,,,,,,,,,,,,,,,,,,,,,,,,,,,,,,,,,,,,,,,,100,Arsenic (Stage 3),Arsenic (Stage 1),,,,,,,,,,,,,,,,,,,,,,,,,,,
Arsenic (Stage 3),"This toxin is a compound of arsenic and other substances. You can't reduce your sickened condition while affected.

<strong>Saving Throw</strong> DC 18 Fortitude
<strong>Onset</strong> 10 minutes
<strong>Maximum Duration</strong> 5 minutes
<strong>Stage 1</strong> 1d4 poison damage and sickened 1 (1 minute)
<strong>Stage 2</strong> 1d6 poison damage and sickened 2 (1 minute)
<var><strong>Stage 3</strong> 2d6 poison damage and sickened 3 (1 minute)</var>",,hidden,,,,,,,,,"Every time you reach this stage or fail your saving throw to reduce the stage, take 2d6 poison damage.",Sickened,,,,,,,,,3,,,,,,,,,,,,,,,,,,,,,,,,,,,,,,,,,,,,,,,,,,,,,,,,,,,,,,,,,,,,,,,,,,,,,,,,,,,,,,,,,,,,,,,,,,,,,,,,,,,,,,,,,,,,,,,,,,,,,,,,,,,,,,,,,,,,,,,,,,,,,,,,,,,,,,,,,,,,,,,,,,,,,,,,,,,,,,,,,,,,,,,,,,,,,,,,,,,,,,,,,,,,,,,,,,,,,,,,,,100,,Arsenic (Stage 2),,,,,,,,,,,,,,,,,,,,,,,,,,,
Viper Arrow,"Your arrow has transformed into a viper (Pathfinder Bestiary 302). The viper has the summoned trait and acts at the end of your turn, even though you didn't use the Sustain a Spell action. It is under the GM's control, but it generally attacks the creature the arrow struck. The viper vanishes after the duration or when slain.",,ammunition,,,,,,,TRUE,,,,,,,,,,,,,,,,,,,,,,,,,,,,,,,,,,,,,,,,,,,,,,,,,,,,,,,,,,,,,,,,,,,,,,,,,,,,,,,,,,,,,,,,,,,,,,,,,,,,,,,,,,,,,,,,,,,,,,,,,,,,,,,,,,,,,,,,,,,,,,,,,,,,,,,,,,,,,,,,,,,,,,,,,,,,,,,,,,,,,,,,,,,,,,,,,,,,,,,,,,,,,,,,,,,,,,,,,,,,,,,,,,,,,,,,,,,,,,,,,,,,,,,,,,,,,,,,,,,
Everstand Stance,"When in this stance, you wield the shield with both hands. When wielding a shield this way, increase the weapon damage die of the shield's boss or spikes by one step, and increase the shield's Hardness by 2 when using the Shield Block reaction.","Attacks, Shield, Shield Block",activities,,,,Shield Boss Dice Number,,1,TRUE,You wield the shield with both hands. Increase the shield's Hardness by 2 when using the Shield Block reaction.,,,,,,,,,Shield Spikes Dice Number,1,,,,,,,,,,,,,,,,,,,,,,,,,,,,,,,,,,,,,,,,,,,,,,,,,,,,,,,,,,,,,,,,,,,,,,,,,,,,,,,,,,,,,,,,,,,,,,,,,,,,,,,,,,,,,,,,,,,,,,,,,,,,,,,,,,,,,,,,,,,,,,,,,,,,,,,,,,,,,,,,,,,,,,,,,,,,,,,,,,,,,,,,,,,,,,,,,,,,,,,,,,,,,,,,,,,,,,,,,,,,,,,,,,,,,,,,,,,,,,,,,,,,,,,,
Point-Blank Shot,"When using a ranged volley weapon while you are in this stance, you don't take the penalty to your attack rolls from the volley trait. When using a ranged weapon that doesn't have the volley trait, you gain a +2 circumstance bonus to damage rolls on attacks against targets within the weapon's first range increment.","Attacks, ranged",activities,,,,,,,TRUE,"When using a ranged volley weapon while you are in this stance, you don't take the penalty to your attack rolls from the volley trait. When using a ranged weapon that doesn't have the volley trait, you gain a +2 circumstance bonus to damage rolls on attacks against targets within the weapon's first range increment.",,,,,,,,,,,,,,,,,,,,,,,,,,,,,,,,,,,,,,,,,,,,,,,,,,,,,,,,,,,,,,,,,,,,,,,,,,,,,,,,,,,,,,,,,,,,,,,,,,,,,,,,,,,,,,,,,,,,,,,,,,,,,,,,,,,,,,,,,,,,,,,,,,,,,,,,,,,,,,,,,,,,,,,,,,,,,,,,,,,,,,,,,,,,,,,,,,,,,,,,,,,,,,,,,,,,,,,,,,,,,,,,,,,,,,,,,,,,,,,,,,,,,,,,,,,,,,,,,,
Dueling Parry,You can parry attacks against you with your one-handed weapon. You gain a +2 circumstance bonus to AC for the duration as long as you continue to wield a melee weapon in each hand.,,activities,,,,AC,circumstance,2,TRUE,,,,,,,,,,,,,,,,,,,,,,,,,,,,,,,,,,,,,,,,,,,,,,,,,,,,,,,,,,,,,,,,,,,,,,,,,,,,,,,,,,,,,,,,,,,,,,,,,,,,,,,,,,,,,,,,,,,,,,,,,,,,,,,,,,,,,,,,,,,,,,,,,,,,,,,,,,,,,,,,,,,,,,,,,,,,,,,,,,,,,,,,,,,,,,,,,,,,,,,,,,,,,,,,,,,,,,,,,,,,,,,,,,,,,,,,,,,,,,,,,,,,,,,,,,,,,,,,,,,
Twin Parry,"You use your two weapons to parry attacks. You gain a +1 circumstance bonus to AC for the duration, or a +2 circumstance bonus if either weapon has the parry trait. You lose this circumstance bonus if you are no longer wielding a melee weapon in each hand.",,activities,,,,AC,circumstance,Weapons().find(weapon => weapon.traits.includes('Parry')) ? 2 : 1,TRUE,,,,,,,,,,,,,,,,,,,,,,,,,,,,,,,,,,,,,,,,,,,,,,,,,,,,,,,,,,,,,,,,,,,,,,,,,,,,,,,,,,,,,,,,,,,,,,,,,,,,,,,,,,,,,,,,,,,,,,,,,,,,,,,,,,,,,,,,,,,,,,,,,,,,,,,,,,,,,,,,,,,,,,,,,,,,,,,,,,,,,,,,,,,,,,,,,,,,,,,,,,,,,,,,,,,,,,,,,,,,,,,,,,,,,,,,,,,,,,,,,,,,,,,,,,,,,,,,,,,
Disarming Stance,"You adopt a fencing stance that improves your control over your weapon. While you are in this stance, you gain a +1 circumstance bonus to Athletics checks to Disarm and a +2 circumstance bonus to your Reflex DC when defending against checks to Disarm you. In addition, you can attempt to Disarm creatures up to two sizes larger than you.","Athletics, Reflex",activities,,,,,,,TRUE,"You gain a +1 circumstance bonus to Athletics checks to Disarm and a +2 circumstance bonus to your Reflex DC when defending against checks to Disarm you. In addition, you can attempt to Disarm creatures up to two sizes larger than you.",,,,,,,,,,,,,,,,,,,,,,,,,,,,,,,,,,,,,,,,,,,,,,,,,,,,,,,,,,,,,,,,,,,,,,,,,,,,,,,,,,,,,,,,,,,,,,,,,,,,,,,,,,,,,,,,,,,,,,,,,,,,,,,,,,,,,,,,,,,,,,,,,,,,,,,,,,,,,,,,,,,,,,,,,,,,,,,,,,,,,,,,,,,,,,,,,,,,,,,,,,,,,,,,,,,,,,,,,,,,,,,,,,,,,,,,,,,,,,,,,,,,,,,,,,,,,,,,,,
Impassable Wall Stance,"You refuse to let foes past your guard. As long as you are in this stance, when you critically hit with an Attack of Opportunity triggered by a move action, you disrupt that move action.","Attacks, Attack of Opportunity, Attack of Opportunity (Fighter)",activities,,,,,,,TRUE,"When you critically hit with an Attack of Opportunity triggered by a move action, you disrupt that move action.",,,,,,,,,,,,,,,,,,,,,,,,,,,,,,,,,,,,,,,,,,,,,,,,,,,,,,,,,,,,,,,,,,,,,,,,,,,,,,,,,,,,,,,,,,,,,,,,,,,,,,,,,,,,,,,,,,,,,,,,,,,,,,,,,,,,,,,,,,,,,,,,,,,,,,,,,,,,,,,,,,,,,,,,,,,,,,,,,,,,,,,,,,,,,,,,,,,,,,,,,,,,,,,,,,,,,,,,,,,,,,,,,,,,,,,,,,,,,,,,,,,,,,,,,,,,,,,,,,
