Illusory Disguise,29ed7d12-9122-11ea-bb37-0242ac130002,Make yourself look like a different creature.,2A,"somatic, verbal",,,1,Arcane,Occult,,,Illusion,Visual,,,,,,,,,,,,,self,,,,,,1 hour,"You create an illusion that causes you to appear as another creature of the same body shape, and with roughly similar height (within 6 inches) and weight (within 50 pounds), as yourself. <var>var1</var> You can change the appearance of your clothing and worn items, such as making your armor look like a dress. Held items are unaffected, and any worn item you remove returns to its true appearance.

Casting illusory disguise counts as setting up a disguise for the Impersonate use of Deception; it ignores any circumstance penalties you might take for disguising yourself as a dissimilar creature, it gives you a +4 status bonus to Deception checks to prevent others from seeing through your disguise, and you add your level even if you're untrained. You can Dismiss this spell.",,,,,,,,"The spell also disguises your voice and scent, and it gains the auditory trait.",(2nd),"You can appear as any creature of the same size, even a specific individual. You must have seen an individual to take on their appearance. The spell also disguises your voice and scent, and it gains the auditory trait.",(3rd),,,,,,,,,,,,,,,6000,1,Illusory Disguise (1st Level),Illusory Disguise,,,6000,2,Illusory Disguise (2nd Level),Illusory Disguise,,,6000,3,Illusory Disguise (3rd level),Illusory Disguise,,,,,,,,,,,,,,,,,,,,,,,,,,,,,,,,,,,,,,,"The disguise is typically good enough to hide your identity, but not to impersonate a specific individual. The spell doesn't change your voice, scent, or mannerisms.",var1,,,,,"The disguise is typically good enough to hide your identity, but not to impersonate a specific individual. The spell also disguises your voice and scent, and it gains the auditory trait. It doesn't disguise your mannerisms.",var1,,,,,,,,,,,,,,,,,"You can appear as any creature of the same size, even a specific individual. You must have seen an individual to take on their appearance. The spell also disguises your voice and scent, and it gains the auditory trait. It doesn't disguise your mannerisms.",var1,,,,,,,,,,,,,,,,,,,,,,,,,,,,,,,,,,,,,,,,,,,,,,,,,,,,,,,,,,,,,,,,,,,,,,,,,,,,,,,,,,,,,,,,,,,,,,,,,,,,,,,,,,,,,,,,,,,,,,,,,,,,,,,,,,,,,,
Illusory Object,29ed7e66-9122-11ea-bb37-0242ac130002,Form a convincing illusion of an object.,2A,"somatic, verbal",,,1,Arcane,Occult,,,Illusion,Visual,,,,,,,,,,500 feet,20-foot burst,,self,,,,,,10 minutes,"You create an illusory visual image of a stationary object. The entire image must fit within the spell's area. <var>var1</var>

Any creature that touches the image or uses the Seek action to examine it can attempt to disbelieve your illusion.",,,,,,,,"Your image makes appropriate sounds, generates normal smells, and feels right to the touch. The spell gains the auditory trait. The duration increases to 1 hour.",(2nd),"As the 2nd-level version, but the duration is unlimited.",(5th),,,,,,,,,,,,,,,1000,1,Illusory Object (1st Level),Illusory Object,,,6000,2,Illusory Object (2nd Level),Illusory Object,,,-1,5,Illusory Object (5th Level),Illusory Object,,,,,,,,,,,,,,,,,,,,,,,,,,,,,,,,,,,,,,,"The object appears to animate naturally, but it doesn't make sounds or generate smells. For example, water would appear to pour down an illusory waterfall, but it would be silent.",var1,,,,,"Your image makes appropriate sounds, generates normal smells, and feels right to the touch. The spell gains the auditory trait. The duration increases to 1 hour.",var1,,,,,,,,,,,,,,,,,,,,,,,,,,,,,,,,,,,,,,,,,,,,,,,,,,,,,,,,,,,"Your image makes appropriate sounds, generates normal smells, and feels right to the touch. The spell gains the auditory trait. The duration is unlimited.",var1,,,,,,,,,,,,,,,,,,,,,,,,,,,,,,,,,,,,,,,,,,,,,,,,,,,,,,,,,,,,,,,,,,,,,,,,,,,,,,,,,,,,,,,,,,,,
Imprint Message,c0061aaf-94c4-45fe-a69f-3368964a9109,Imprint a psychic message into an object.,2A,"somatic, verbal",Pathfinder #147: Tomorrow Must Burn,,1,Occult,,,,Uncommon,Divination,,,,,,,,,,touch,,1 object,,TRUE,,,,,,"You project psychic vibrations onto the target object, imprinting it with a short message or emotional theme of your design. This imprinted sensation is revealed to anyone casting object reading on the target object, replacing any emotional events the item was present for. If the object is in the area of a retrocognition spell, the imprinted messages appear as major events in the timeline, but they don't interfere with any other visions. If the object is targeted with read aura of a higher spell level than imprint message, the caster learns that the object has been modified. When you Cast this Spell, any prior vibrations placed in an object by previous castings of imprint message fade.",,,,,,,,,,,,,,,,,,,,,,,,,,-1,,Imprint Message,Imprint Message,,,,,,,,,,,,,,,,,,,,,,,,,,,,,,,,,,,,,,,,,,,,,,,,,,,,,,,,,,,,,,,,,,,,,,,,,,,,,,,,,,,,,,,,,,,,,,,,,,,,,,,,,,,,,,,,,,,,,,,,,,,,,,,,,,,,,,,,,,,,,,,,,,,,,,,,,,,,,,,,,,,,,,,,,,,,,,,,,,,,,,,,,,,,,,,,,,,,,,,,,,,,,,,,,,
Item Facade,29ed7f74-9122-11ea-bb37-0242ac130002,Disguise an item to look perfect or shoddy.,2A,"somatic, verbal",,,1,Arcane,Occult,,,Illusion,Visual,,,,,,,,,,touch,,1 object no more than 10 feet by 10 feet by 10 feet,,TRUE,,,,,1 hour,"You make the target object look and feel as though it were in much better or worse physical condition. <var>var1</var>When you cast this spell, decide whether you want to make the object look decrepit or perfect. An item made to look decrepit appears broken and shoddy. An intact item made to look better appears as though it's brand new and highly polished or well maintained. A broken item appears to be intact and functional. Destroyed items can't be affected by this spell. A creature that Interacts with the item can attempt to disbelieve the illusion.",,,,,,,,The duration is 24 hours.,(2nd),The duration is unlimited.,(3rd),,,,,,,,,,,,,,,6000,1,Item Facade,Item Facade,caster,,144000,2,Item Facade,Item Facade,caster,,-1,3,Item Facade,Item Facade,caster,,,,,,,,,,,,,,,,,,,,,,,,,,,,,,,,,,,,,,,var1,,,,,The duration is 24 hours. ,var1,,,,,,,,,,,,,,,,,The duration is unlimited. ,var1,,,,,,,,,,,,,,,,,,,,,,,,,,,,,,,,,,,,,,,,,,,,,,,,,,,,,,,,,,,,,,,,,,,,,,,,,,,,,,,,,,,,,,,,,,,,,,,,,,,,,,,,,,,,,,,,,,,,,,,,,,,,,,,,,,,,,,
Jump,29ed80dc-9122-11ea-bb37-0242ac130002,Make an impressive leap.,1A,somatic,,,1,Arcane,Primal,,,Move,Transmutation,,,,,,,,,,,,,ally,,,,,,,"<var>var1</var>Your legs surge with strength, ready to leap high and far. You jump 30 feet in any direction without touching the ground. You must land on a space of solid ground within 30 feet of you, or else you fall after using your next action.",,,,,,,,"The range becomes touch, the target changes to one touched creature, and the duration becomes 1 minute, allowing the target to jump as described whenever it takes the Leap action.",(3rd),,,,,,,,,,,,,,,,,0,1,Jump,Jump,,,100,3,Jump,Jump,,,,,,,,,,,,,,,,,,,,,,,,,,,,,,,,,,,,,,,,,,,,,,var1,,,,,,,,,,,,,,,,,,,,,,,"The range becomes touch, the target changes to one touched creature, and the duration becomes 1 minute, allowing the target to jump as described whenever it takes the Leap action. ",var1,,,,,,,,,,,,,,,,,,,,,,,,,,,,,,,,,,,,,,,,,,,,,,,,,,,,,,,,,,,,,,,,,,,,,,,,,,,,,,,,,,,,,,,,,,,,,,,,,,,,,,,,,,,,,,,,,,,,,,,,,,,,,,,,,,,,,,
Liberating Command,29ed81f4-9122-11ea-bb37-0242ac130002,"You call out a liberating cry, urging an ally to break free of an effect that holds them in place.",1A,verbal,Gods & Magic,,1,Occult,,,,Enchantment,Mental,,,,,,,,,,60 feet,,1 creature,ally,TRUE,,,,,,"You call out a liberating cry, urging an ally to break free of an effect that holds them in place. If the target is grabbed, immobilized, or restrained, it can immediately use a reaction to attempt to Escape.",,,,,,,,,,,,,,,,,,,,,,,,,,,,,,,,,,,,,,,,,,,,,,,,,,,,,,,,,,,,,,,,,,,,,,,,,,,,,,,,,,,,,,,,,,,,,,,,,,,,,,,,,,,,,,,,,,,,,,,,,,,,,,,,,,,,,,,,,,,,,,,,,,,,,,,,,,,,,,,,,,,,,,,,,,,,,,,,,,,,,,,,,,,,,,,,,,,,,,,,,,,,,,,,,,,,,,,,,,,,,,,,,,,,,,,,,,,,,,,
Lock,29ed8352-9122-11ea-bb37-0242ac130002,Make a lock hard to open.,2A,"somatic, verbal",,,1,Arcane,Occult,Divine,,Abjuration,,,,,,,,,,,touch,,"1 lock, or a door or container with a latch",,TRUE,,,,,1 day,"<var>var1</var>The target's latch mechanism clinks shut, held fast by unseen magical restraints. When you magically lock a target, you set an Athletics and Thievery DC to open it equal to your spell DC or the base lock DC with a +4 status bonus, whichever is higher. Any key or combination that once opened a lock affected by this spell does not do so for the duration of the spell, though the key or combination does grant a +4 circumstance bonus to checks to open the door.

If the target is opened, the spell ends. Assuming the target is not barred or locked in some additional way, you can unlock and open it with an Interact action during which you touch the target. This does not end the spell. You can Dismiss this spell at any time and from any distance.",,,,,,,,"The duration increases to unlimited, but you must expend 6 gp worth of gold dust as an additional cost.",(2nd),,,,,,,,,,,,,,,,,144000,1,Lock,Lock,caster,,-1,2,Lock,Lock,caster,,,,,,,,,,,,,,,,,,,,,,,,,,,,,,,,,,,,,,,,,,,,,var1,,,,,"The duration increases to unlimited, but you must expend 6 gp worth of gold dust as an additional cost. ",var1,,,,,,,,,,,,,,,,,,,,,,,,,,,,,,,,,,,,,,,,,,,,,,,,,,,,,,,,,,,,,,,,,,,,,,,,,,,,,,,,,,,,,,,,,,,,,,,,,,,,,,,,,,,,,,,,,,,,,,,,,,,,,,,,,,,,,,,,,,,,,,,,,,,,,,,,
Longstrider,29ed8488-9122-11ea-bb37-0242ac130002,Increase your Speed for an hour.,2A,"somatic, verbal",,,1,Arcane,Primal,,,Transmutation,,,,,,,,,,,,,,self,,,,,,1 hour,<var>var1</var>You lengthen your stride beyond what should be possible. You gain a +10-foot status bonus to your Speed.,,,,,,,,The duration increases to 8 hours.,(2nd),,,,,,,,,,,,,,,,,6000,1,Longstrider,Longstrider,,,48000,2,Longstrider,Longstrider,,,,,,,,,,,,,,,,,,,,,,,,,,,,,,,,,,,,,,,,,,,,,,var1,,,,,The duration increases to 8 hours. ,var1,,,,,,,,,,,,,,,,,,,,,,,,,,,,,,,,,,,,,,,,,,,,,,,,,,,,,,,,,,,,,,,,,,,,,,,,,,,,,,,,,,,,,,,,,,,,,,,,,,,,,,,,,,,,,,,,,,,,,,,,,,,,,,,,,,,,,,,,,,,,,,,,,,,,,,,,
Mage Armor,29ed8578-9122-11ea-bb37-0242ac130002,Ward yourself with magical armor.,2A,"somatic, verbal",,,1,Arcane,Occult,,,Abjuration,,,,,,,,,,,,,,self,,,,,,until the next time you make your daily preparations,"You ward yourself with shimmering magical energy, gaining a <var>var1</var> item bonus to AC and a maximum Dexterity modifier of +5. <var>var2</var>While wearing mage armor, you use your unarmored proficiency to calculate your AC.",,,,,,,,You gain a +1 item bonus to saving throws.,(4th),"The item bonus to AC increases to +2, and you gain a +1 item bonus to saving throws.",(6th),"The item bonus to AC increases to +2, and you gain a +2 item bonus to saving throws.",(8th),"The item bonus to AC increases to +3, and you gain a +3 item bonus to saving throws.",(10th),,,,,,,,,,,,,,,,,,,,,,,,,,,,,,,,,,,,,,,,,,,,,-2,1,Mage Armor (1st Level),armors,-2,4,Mage Armor (4th Level),armors,-2,6,Mage Armor (6th Level),armors,-2,8,Mage Armor (8th Level),armors,-2,10,Mage Armor (10th Level),armors,1,var1,,var2,,,,,,,,,,,,,,,,,,,,,,,,,,,,,,,,,,,,,,,1,var1,You gain a +1 item bonus to saving throws. ,var2,,,,,,,,,,,,,,,,,,,,,,,,,,,,,,,,,,,,,,,,,,,,,2,var1,You gain a +1 item bonus to saving throws. ,var2,,,,,,,,,,,,,,,,,,,,,,,,,,,,,,,,,,,,,,,,,,,2,var1,You gain a +2 item bonus to saving throws. ,var2,,,,,,,,,,,,,3,var1,You gain a +3 item bonus to saving throws. ,var2,,,,
Magic Aura,29ed86ae-9122-11ea-bb37-0242ac130002,Change how an item's magic appears to detecting spells.,1 minute,"material, somatic, verbal",,,1,Arcane,Occult,,,Uncommon,Illusion,,,,,,,,,,touch,,1 object of 3 bulk or less,,TRUE,,,,,until the next time you make your daily preparations,"You alter the appearance of an item's magic aura. You can choose to have the target's aura appear as that of common magic item of twice magic aura's level or lower, or to have it register as being under the effects of a spell of your choice of magic aura's level or lower. If the target is magical, you can instead choose to have it appear as entirely non-magical. <var>var1</var>

A caster using detect magic or read aura of an equal or higher spell level can attempt to disbelieve the illusion from magic aura. Magic aura doesn't mask the aura of spells that are 9th level or higher or of items that are 19th level or higher.",,,,,,,,"You can target a creature instead of an object. When you do, you can either conceal the auras of all magic items it has or have that creature's aura appear as if it were under the effect of a spell you know.",(3rd),,,,,,,,,,,,,,,,,-2,1,Magic Aura (1st Level),Magic Aura,caster,,-2,3,Magic Aura (3rd level),Magic Aura,caster,,,,,,,,,,,,,,,,,,,,,,,,,,,,,,,,,,,,,,,,,,,,,var1,,,,,,,,,,,,,,,,,,,,,,,"You can target a creature instead of an object. When you do, you can either conceal the auras of all magic items it has or have that creature's aura appear as if it were under the effect of a spell you know.",var1,,,,,,,,,,,,,,,,,,,,,,,,,,,,,,,,,,,,,,,,,,,,,,,,,,,,,,,,,,,,,,,,,,,,,,,,,,,,,,,,,,,,,,,,,,,,,,,,,,,,,,,,,,,,,,,,,,,,,,,,,,,,,,,,,,,,,,
Magic Fang,29ed87e4-9122-11ea-bb37-0242ac130002,Make a creature's unarmed attacks magical temporarily.,2A,"somatic, verbal",,,1,Primal,,,,Transmutation,,,,,,,,,,,touch,,1 willing creature,ally,TRUE,,,,,1 minute,"Choose one of the target's unarmed attacks. You cause that unarmed attack to shine with primal energy. The unarmed attack becomes a +1 striking unarmed attack, gaining a +1 item bonus to attack rolls and increasing the number of damage dice to two if it had only one.",,,,,,,,,,,,,,,,,,,,,,,,,,100,,Magic Fang,Magic Fang,,,,,,,,,,,,,,,,,,,,,,,,,,,,,,,,,,,,,,,,,,,,,,,,,,,,,,,,,,,,,,,,,,,,,,,,,,,,,,,,,,,,,,,,,,,,,,,,,,,,,,,,,,,,,,,,,,,,,,,,,,,,,,,,,,,,,,,,,,,,,,,,,,,,,,,,,,,,,,,,,,,,,,,,,,,,,,,,,,,,,,,,,,,,,,,,,,,,,,,,,,,,,,,,,,
Magic Missile,29ed8906-9122-11ea-bb37-0242ac130002,Pelt creatures with unerring bolts of magical force.,1A to 3A,"somatic, verbal",,,1,Arcane,Occult,,,Evocation,Force,,,,,,,,,,120 feet,,1 creature,,TRUE,,,,,,"You send <var>var1</var> of force streaking toward a creature that you can see. It automatically hits and deals 1d4+1 force damage. For each additional action you use when Casting the Spell, increase the number of missiles you shoot by <var>var2</var>, to a maximum of <var>var3</var> missiles for 3 actions. You choose the target for each missile individually. If you shoot more than one missile at the same target, combine the damage before applying bonuses or penalties to damage, resistances, weaknesses, and so forth.",,,,,,,,You shoot one additional missile with each action you spend.,(+2),,,,,,,,,,,,,,,,,,,,,,,,,,,,,,,,,,,,,,,,,,,,,,,,,,,,,,,,,,,,,,,,,,,,,,,a dart,var1,one,var2,three,var3,,,,,,,,,,,,,,,,,,,two darts,var1,two,var2,six,var3,,,,,,,,,,,,,,,,,,,,,,,,,,,,,,,,,,,,,three darts,var1,three,var2,nine,var3,,,,,,,,,,,,,,,,,,,,,,,,,,,,,,,,,,,,,,,,,four darts,var1,four,var2,12,var3,,,,,,,,,,,,,,,,,,,,,,,,,,,five darts,var1,five,var2,15,var3,,,,,,,,,,
Magic Weapon,29ed8afa-9122-11ea-bb37-0242ac130002,Make a weapon temporarily magical.,2A,"somatic, verbal",,,1,Arcane,Occult,Divine,,Transmutation,,,,,,,,,,,touch,,1 non-magical weapon that is unattended or wielded by you or a willing ally,ally,TRUE,,,,,1 minute,"The weapon glimmers with magic and energy. The target becomes a +1 striking weapon, gaining a +1 item bonus to attack rolls and increasing the number of weapon damage dice to two.",,,,,,,,,,,,,,,,,,,,,,,,,,100,,Magic Weapon,Magic Weapon,,,,,,,,,,,,,,,,,,,,,,,,,,,,,,,,,,,,,,,,,,,,,,,,,,,,,,,,,,,,,,,,,,,,,,,,,,,,,,,,,,,,,,,,,,,,,,,,,,,,,,,,,,,,,,,,,,,,,,,,,,,,,,,,,,,,,,,,,,,,,,,,,,,,,,,,,,,,,,,,,,,,,,,,,,,,,,,,,,,,,,,,,,,,,,,,,,,,,,,,,,,,,,,,,,
Mending,29ed8c08-9122-11ea-bb37-0242ac130002,Repair one non-magical item.,10 minutes,"somatic, verbal",,,1,Arcane,Occult,Divine,Primal,Transmutation,,,,,,,,,,,touch,,non-magical object of light Bulk or less,,TRUE,,,,,,"<var>var1</var>You repair the target item. You restore 5 Hit Points per spell level to the target, potentially removing the broken condition if this repairs it past the item's Broken Threshold. You can't replace lost pieces or repair an object that's been completely destroyed.",,,,,,,,You can target a non-magical object of 1 Bulk or less.,(2nd),"You can target a non-magical object of 2 Bulk or less, or a magical object of 1 Bulk or less.",(3rd),,,,,,,,,,,,,,,,,,,,,,,,,,,,,,,,,,,,,,,,,,,,,,,,,,,,,,,,,,,,,,,,,,,,,,var1,,,,,You can target a non-magical object of 1 Bulk or less. ,var1,,,,,,,,,,,,,,,,,"You can target a non-magical object of 2 Bulk or less, or a magical object of 1 Bulk or less. ",var1,,,,,,,,,,,,,,,,,,,,,,,,,,,,,,,,,,,,,,,,,,,,,,,,,,,,,,,,,,,,,,,,,,,,,,,,,,,,,,,,,,,,,,,,,,,,,,,,,,,,,,,,,,,,,,,,,,,,,,,,,,,,,,,,,,,,,,
Message Rune,29ed8d34-9122-11ea-bb37-0242ac130002,You record a message up to 5 minutes long and inscribe a special rune on any flat unattended surface within reach.,5 minutes,"material, somatic, verbal",Gods & Magic,,1,Arcane,Occult,,,Divination,Linguistic,Mental,,,,,,,,,touch,,1 flat unattended surface,,,,,,,1 day,"You record a message up to 5 minutes long and inscribe a special rune on any flat unattended surface within reach. The nature of the rune's appearance is up to you, but it is visible to everyone and it must be no smaller than 2 inches in diameter. You also specify a trigger that creatures must meet to activate the rune. For the duration of the spell, creatures who meet the criteria of the trigger can touch the rune to hear the recorded message in their head as though you were speaking to them telepathically. You know when someone is listening to the message, but you do not know who is listening to it. You can Dismiss the spell.",,,,,,,,,,,,,,,,,,,,,,,,,,144000,,Message Rune,Message Rune,caster,,,,,,,,,,,,,,,,,,,,,,,,,,,,,,,,,,,,,,,,,,,,,,,,,,,,,,,,,,,,,,,,,,,,,,,,,,,,,,,,,,,,,,,,,,,,,,,,,,,,,,,,,,,,,,,,,,,,,,,,,,,,,,,,,,,,,,,,,,,,,,,,,,,,,,,,,,,,,,,,,,,,,,,,,,,,,,,,,,,,,,,,,,,,,,,,,,,,,,,,,,,,,,,,,
Mindlink,29ed8e7e-9122-11ea-bb37-0242ac130002,Mentally impart 10 minutes' worth of information in an instant.,2A,"somatic, verbal",,,1,Occult,,,,Divination,Mental,,,,,,,,,,touch,,1 willing creature,,TRUE,,,,,,You link your mind to the target's mind and mentally impart to that target an amount of information in an instant that could otherwise be communicated in 10 minutes.,,,,,,,,,,,,,,,,,,,,,,,,,,,,,,,,,,,,,,,,,,,,,,,,,,,,,,,,,,,,,,,,,,,,,,,,,,,,,,,,,,,,,,,,,,,,,,,,,,,,,,,,,,,,,,,,,,,,,,,,,,,,,,,,,,,,,,,,,,,,,,,,,,,,,,,,,,,,,,,,,,,,,,,,,,,,,,,,,,,,,,,,,,,,,,,,,,,,,,,,,,,,,,,,,,,,,,,,,,,,,,,,,,,,,,,,,,,,,,,
Negate Aroma,29ed8fbe-9122-11ea-bb37-0242ac130002,Suppress a creature's scent.,2A,"somatic, verbal",,,1,Arcane,Primal,,,Abjuration,,,,,,,,,,,touch,,1 willing creature,ally,TRUE,,,,,1 hour,"<var>var1</var>The target loses its odor, preventing creatures from passively noticing its presence via smell alone, even if the creatures have precise or imprecise scent. A creature attempting a Perception check to Seek with scent and other senses might notice the lack of natural scent. If the target has any abilities that result from its smell, such as an overpowering scent, those abilities are also negated.",,,,,,,,"The range increases to 30 feet, and you can target up to 10 creatures.",(5th),,,,,,,,,,,,,,,,,6000,,Negate Aroma,Negate Aroma,,,,,,,,,,,,,,,,,,,,,,,,,,,,,,,,,,,,,,,,,,,,,,,,,,,,var1,,,,,,,,,,,,,,,,,,,,,,,,,,,,,,,,,,,,,,,,,,,,,,,,,,,,,,,,,,,,,,,,,"The range increases to 30 feet, and you can target up to 10 creatures. ",var1,,,,,,,,,,,,,,,,,,,,,,,,,,,,,,,,,,,,,,,,,,,,,,,,,,,,,,,,,,,,,,,,,,,,,,,,,,,,,,,,,,,,,,,,,,,,
Object Reading,ee009149-4673-4ec2-b122-39b69c7622fd,Learn about a significant event surrounding an object.,2A,"somatic, verbal",Pathfinder #147: Tomorrow Must Burn,,1,Occult,,,,Uncommon,Divination,,,,,,,,,,touch,,1 object,,,,,,,,"You place a hand on an object to learn a piece of information about an emotional event that occurred involving the object within <var>var1</var>, determined by the GM. If you cast object reading on the same item multiple times, you can either concentrate on a single event to gain additional pieces of information about that event, or you can gain a piece of information about another emotional event in the applicable time frame.",,,,,,,,You can learn about an event that occurred within the last month.,(2nd),You can learn about an event that occurred within the last year.,(4th),You can learn about an event that occurred within the last decade.,(6th),You can learn about an event that occurred within the last century.,(8th),You can learn about an event that occurred within the entirety of the object's history.,(9th),,,,,,,,,,,,,,,,,,,,,,,,,,,,,,,,,,,,,,,,,,,,,,,,,,,,,,,,,,,,,,,the past week,var1,,,,,the last month,var1,,,,,,,,,,,,,,,,,,,,,,,,,,,,,,,,,,,the last year,var1,,,,,,,,,,,,,,,,,,,,,,,,,,,,,,,,,,,,,,,,,,,,,,,the last decade,var1,,,,,,,,,,,,,,,,,,,,,,,,,,,,,,,,,,,,,,,,,,,,,the last century,var1,,,,,,,the entirety of the object's history,var1,,,,,,,,,,,,,,
Pass without Trace,29ed907c-9122-11ea-bb37-0242ac130002,Make your tracks hard to find.,2A,"somatic, verbal",,,1,Primal,,,,Abjuration,,,,,,,,,,,,,,self,,,,,,1 hour,"<var>var1</var>You obscure the tracks you leave behind and make it harder for others to find you. The DC of checks to Track you gains a +4 status bonus or is equal to your spell DC, whichever results in a higher DC. You can benefit from only one pass without trace spell at a time.",,,,,,,,The duration increases to 8 hours.,(2nd),"The duration increases to 8 hours. The spell has a range of 20 feet and an area of a 20-foot-emanation, affecting up to 10 creatures of your choice within that area.",(4th),,,,,,,,,,,,,,,6000,1,Pass without Trace,Pass without Trace,,,48000,2,Pass without Trace,Pass without Trace,,,48000,4,Pass without Trace,Pass without Trace,,,,,,,,,,,,,,,,,,,,,,,,,,,,,,,,,,,,,,,,var1,,,,,,var1,,,,,,,,,,,,,,,,,,,,,,,,,,,,,,,,,,,"The spell has a range of 20 feet and an area of a 20-foot-emanation, affecting up to 10 creatures of your choice within that area.",var1,,,,,,,,,,,,,,,,,,,,,,,,,,,,,,,,,,,,,,,,,,,,,,,,,,,,,,,,,,,,,,,,,,,,,,,,,,,,,,,,,,,,,,,,,,,,,,,,,,,,,,,,,,,,,,,,,,,,
Penumbral Shroud,29ed91da-9122-11ea-bb37-0242ac130002,You envelop the target in a shroud of shadow.,2A,"somatic, verbal",Gods & Magic,,1,Arcane,Occult,,,Darkness,Evocation,,,,,,,,,,30 feet,,1 creature,ally,TRUE,,,,,10 minutes,"You envelop the target in a shroud of shadow. The target perceives light as one step lower than it actually is (bright light becomes dim light, for example), affecting their ability to sense creatures and objects accordingly. The shroud also provides the target a +1 status bonus to saving throws against light effects. While this effect is helpful to creatures sensitive to light, if the creature is unwilling, it can attempt a Reflex save to avoid the shroud and reduce the effect.",,The target is unaffected.,The effect lasts for 1 round,The effect lasts its normal duration.,,,,,,,,,,,,,,,,,,,,,,1000,,Penumbral Shroud,Penumbral Shroud,,,,,,,,,,,,,,,,,,,,,,,,,,,,,,,,,,,,,,,,,,,,,,,,,,,,,,,,,,,,,,,,,,,,,,,,,,,,,,,,,,,,,,,,,,,,,,,,,,,,,,,,,,,,,,,,,,,,,,,,,,,,,,,,,,,,,,,,,,,,,,,,,,,,,,,,,,,,,,,,,,,,,,,,,,,,,,,,,,,,,,,,,,,,,,,,,,,,,,,,,,,,,,,,,,
Personal Rain Cloud,470d9568-f684-46c4-bcd8-3c3474dd622c,You conjure a 5-foot-wide rain cloud that follows the target wherever it goes.,2A,"somatic, verbal",Pathfinder #151: The Show Must Go On,,1,Arcane,Primal,,,Uncommon,Evocation,Water,,,,,,,,,60 feet,,1 creature,ally,TRUE,,,,,1 minute,"You conjure a 5-foot-wide rain cloud that follows the target wherever it goes. It stays roughly an arm's length overhead, unless it must drift lower to fit under a ceiling. The cloud rains constantly on the target, keeping it wet and dampening the ground in the wake of any movement. The rain extinguishes non-magical flames. The target gains fire resistance <var>var1</var>. Creatures with weakness to water take damage equal to their weakness at the end of each of their turns. Creatures can attempt a Reflex save to avoid the cloud.",Reflex,,,,,,,The amount of fire resistance increases by 2.,(+1),,,,,,,,,,,,,,,,,100,,Personal Rain Cloud,Personal Rain Cloud,,,,,,,,,,,,,,,,,,,,,,,,,,,,,,,,,,,,,,,,,,,,,,,,,,,2,var1,,,,,4,var1,,,,,,,,,,,,,,,,,6,var1,,,,,,,,,,,,,,,,,8,var1,,,,,,,,,,,,,,,,,,,,,,,10,var1,,,,,,,,,,,,,,,,,,,,,,,12,var1,,,,,,,,,,,,,,,,,,,,,14,var1,,,,,,,,,,,,,,,,,,,,,,,16,var1,,,,,,,18,var1,,,,,,,20,var1,,,,,,
