Illusory Creature,29ee3ee6-9122-11ea-bb37-0242ac130002,Form a convincing illusion of a creature.,2A,"somatic, verbal",,,2,Arcane,Occult,,,Auditory,Illusion,Visual,,,,,,,,,500 feet,,,self,,,,,1000,sustained,"You create an illusory image of a <var>var1</var> or smaller creature. It generates the appropriate sounds, smells, and feels believable to the touch. If you and the image are ever farther than 500 feet apart, the spell ends.

The image can't speak, but you can use your actions to speak through the creature, with the spell disguising your voice as appropriate. You might need to attempt a Deception or Performance check to mimic the creature, as determined by the GM. This is especially likely if you're trying to imitate a specific person and engage with someone that person knows.

In combat, the illusion can use 2 actions per turn, which it uses when you Sustain the Spell. It uses your spell attack roll for attack rolls and your spell DC for its AC. Its saving throw modifiers are equal to your spell DC - 10. It is substantial enough that it can flank other creatures. If the image is hit by an attack or fails a save, the spell ends.

The illusion can cause damage by making the target believe the illusion's attacks are real, but it cannot otherwise directly affect the physical world. If the illusory creature hits with a Strike, the target takes mental damage equal to <var>var2</var> plus your spellcasting ability modifier. This is a mental effect. The illusion's Strikes are nonlethal. If the damage doesn't correspond to the image of the monster - for example, if an illusory Large dragon deals only 5 damage - the GM might allow the target to attempt a Perception check to disbelieve the spell as a free action. Any relevant resistances and weaknesses apply if the target thinks they do, as judged by the GM. For example, if the illusion wields a warhammer and attacks a creature resistant to bludgeoning damage, the creature would take less mental damage. However, illusory damage does not deactivate regeneration or trigger other effects that require a certain damage type. The GM should track illusory damage dealt by the illusion.

Any creature that touches the image or uses the Seek action to examine it can attempt to disbelieve your illusion. When a creature disbelieves the illusion, it recovers from half the damage it had taken from it (if any) and doesn't take any further damage from it.",,,,,,,,"The damage of the image's Strikes increases by 1d4, and the maximum size of creature you can create increases by one (to a maximum of Gargantuan).",(+1),,,,,,,,,,,,,,,,,1000,,Illusory Creature,Illusory Creature,,,,,,,,,,,,,,,,,,,,,,,,,,,,,,,,,,,,,,,,,,,,,,,,,,,,,,,,,Large,var1,1d4,var2,,,,,,,,,,,,,,,Huge,var1,2d4,var2,,,,,,,,,,,,,,,Gargantuan,var1,3d4,var2,,,,,,,,,,,,,,,,,,,,,Gargantuan,var1,4d4,var2,,,,,,,,,,,,,,,,,,,,,Gargantuan,var1,5d4,var2,,,,,,,,,,,,,,,,,,,Gargantuan,var1,6d4,var2,,,,,,,,,,,,,,,,,,,,,Gargantuan,var1,7d4,var2,,,,,Gargantuan,var1,8d4,var2,,,,,Gargantuan,var1,9d4,var2,,,,
Invisibility,29ee3fae-9122-11ea-bb37-0242ac130002,A creature can't be seen until it attacks.,2A,"material, somatic",,,2,Arcane,Occult,,,Illusion,,,,,,,,,,,touch,,1 creature,ally,TRUE,,,,,10 minutes,"Cloaked in illusion, the target becomes invisible. This makes it undetected to all creatures, though the creatures can attempt to find the target, making it hidden to them instead. <var>var1</var>",,,,,,,,"The spell lasts 1 minute, but it doesn't end if the target uses a hostile action.",(4th),,,,,,,,,,,,,,,,,1000,2,Invisibility (2nd Level),Invisibility,,,1000,4,Invisibility (4th Level),Invisibility,,,,,,,,,,,,,,,,,,,,,,,,,,,,,,,,,,,,,,,,,,,,,,,,,,,"If the target uses a hostile action, the spell ends after that hostile action is completed.",var1,,,,,,,,,,,,,,,,,,,,,,,,,,,,,,,,,,,"The spell lasts 1 minute, but it doesn't end if the target uses a hostile action.",var1,,,,,,,,,,,,,,,,,,,,,,,,,,,,,,,,,,,,,,,,,,,,,,,,,,,,,,,,,,,,,,,,,,,,,,,,,,,,,,,,,,,,,,,,,,,,,,,,,,,,,,,,,,,,,,,,,,,,
Iron Gut,29ee4062-9122-11ea-bb37-0242ac130002,"Your mouth, esophagus, and stomach become incredibly elastic and tougher than metal.",2A,"material, somatic",Gods & Magic,,2,Arcane,Primal,,,Transmutation,,,,,,,,,,,,,,self,,,,,,1 hour,"<var>var1</var>Your mouth, esophagus, and stomach become incredibly elastic and tougher than metal. For the duration of the spell, you can reach down your throat to store or retrieve a single object of light or negligible Bulk in your stomach, as though your stomach were a backpack or other container. Storing and retrieving an item in this way requires an Interact action. The object must be small enough to reasonably fit within your stomach. It is very difficult for other creatures to notice that you are hiding an object in this way; passive observers cant possibly notice and you gain a +4 circumstance bonus to your Stealth checks to Conceal the Object unless the searcher specifically searches your mouth and stomach. If at the end of the spells duration you still have an object stored in your stomach, it is violently expelled, dealing 1d6 damage to you.",,,,,,,,The duration increases to 8 hours.,(3rd),,,,,,,,,,,,,,,,,6000,2,Iron Gut,Iron Gut,,,48000,3,Iron Gut,Iron Gut,,,,,,,,,,,,,,,,,,,,,,,,,,,,,,,,,,,,,,,,,,,,,,,,,,,,var1,,,,,,,,,,,,,,,,,The duration increases to 8 hours. ,var1,,,,,,,,,,,,,,,,,,,,,,,,,,,,,,,,,,,,,,,,,,,,,,,,,,,,,,,,,,,,,,,,,,,,,,,,,,,,,,,,,,,,,,,,,,,,,,,,,,,,,,,,,,,,,,,,,,,,,,,,,,,,,,,,,,,,,,
Knock,29ee4116-9122-11ea-bb37-0242ac130002,"Make a door, lock, or container easier to open, and possibly open it immediately.",2A,"somatic, verbal",,,2,Arcane,Occult,,,Transmutation,,,,,,,,,,,30 feet,,"1 door, lock or container",,TRUE,,,,,1 minute,"You make the target easier to open. Knock grants a +4 status bonus to any creature that tries to open the target door, lock, or container with an Athletics or a Thievery check. You can attempt a Thievery check to open the target as part of casting knock, and you add your level even if you're untrained.

Knock counteracts lock.",,,,,,,,,,,,,,,,,,,,,,,,,,,,,,,,,,,,,,,,,,,,,,,,,,,,,,,,,,,,,,,,,,,,,,,,,,,,,,,,,,,,,,,,,,,,,,,,,,,,,,,,,,,,,,,,,,,,,,,,,,,,,,,,,,,,,,,,,,,,,,,,,,,,,,,,,,,,,,,,,,,,,,,,,,,,,,,,,,,,,,,,,,,,,,,,,,,,,,,,,,,,,,,,,,,,,,,,,,,,,,,,,,,,,,,,,,,,,,,
Magic Mouth,29ee41d4-9122-11ea-bb37-0242ac130002,Make an illusory mouth appear to speak a message.,2A,"somatic, verbal",,,2,Arcane,Occult,,,Auditory,Illusion,Visual,,,,,,,,,touch,,1 creature or object,,TRUE,,,,,unlimited,"You specify a trigger and a message up to 25 words long. When the specified trigger occurs within 30 feet of the target, an illusory mouth appears on the target and speaks the message, and the magic mouth spell ends.",,,,,,,,,,,,,,,,,,,,,,,,,,-1,,Magic Mouth,Magic Mouth,caster,,,,,,,,,,,,,,,,,,,,,,,,,,,,,,,,,,,,,,,,,,,,,,,,,,,,,,,,,,,,,,,,,,,,,,,,,,,,,,,,,,,,,,,,,,,,,,,,,,,,,,,,,,,,,,,,,,,,,,,,,,,,,,,,,,,,,,,,,,,,,,,,,,,,,,,,,,,,,,,,,,,,,,,,,,,,,,,,,,,,,,,,,,,,,,,,,,,,,,,,,,,,,,,,,
Mirror Image,29ee429c-9122-11ea-bb37-0242ac130002,Illusory duplicates of you cause attacks to miss.,2A,"somatic, verbal",,,2,Arcane,Occult,,,Illusion,Visual,,,,,,,,,,,,,self,,,,,,1 minute,"Three illusory images of you swirl about your space, potentially causing those who attack you to hit one of the images instead of you. Any attack that would hit you has a random chance of hitting one of your images instead of you. If all three images remain, there is a 1 in 4 chance of hitting you (1 on 1d4). With two images remaining, there is a 1 in 3 chance of hitting you (1-2 on 1d6). With only one image, the chances are 1 in 2 (1-3 on 1d6).

Once an image is hit, it is destroyed. If an attack roll fails to hit your AC but doesn't critically fail, it destroys an image but has no additional effect (even if the attack would normally have an effect on a failure). If an attack roll is a critical success and would hit one of the images, one of the images is destroyed and the attack roll becomes a success against you. Once all the images are destroyed, the spell ends.",,,,,,,,,,,,,,,,,,,,,,,,,,100,,Mirror Image,Mirror Image,,3,,,,,,,,,,,,,,,,,,,,,,,,,,,,,,,,,,,,,,,,,,,,,,,,,,,,,,,,,,,,,,,,,,,,,,,,,,,,,,,,,,,,,,,,,,,,,,,,,,,,,,,,,,,,,,,,,,,,,,,,,,,,,,,,,,,,,,,,,,,,,,,,,,,,,,,,,,,,,,,,,,,,,,,,,,,,,,,,,,,,,,,,,,,,,,,,,,,,,,,,,,,,,,,,
Misdirection,29ee44b8-9122-11ea-bb37-0242ac130002,Cause one creature's auras to appear to be another's.,1 minute,"somatic, verbal",,,2,Arcane,Occult,,,Illusion,,,,,,,,,,,30 feet,,2 creatures or objects,,,,,,,until the next time you make your daily preparations,You reshape the magic aura of one creature or object to resemble that of another. You designate one target as the primary target and the other as the secondary target. Effects that would detect auras on the primary target instead detect the same types of auras from the secondary target. A creature reading the aura can attempt to disbelieve the illusion. You can Dismiss the spell from up to a mile away.,,,,,,,,,,,,,,,,,,,,,,,,,,-2,,Misdirection,Misdirection,caster,,,,,,,,,,,,,,,,,,,,,,,,,,,,,,,,,,,,,,,,,,,,,,,,,,,,,,,,,,,,,,,,,,,,,,,,,,,,,,,,,,,,,,,,,,,,,,,,,,,,,,,,,,,,,,,,,,,,,,,,,,,,,,,,,,,,,,,,,,,,,,,,,,,,,,,,,,,,,,,,,,,,,,,,,,,,,,,,,,,,,,,,,,,,,,,,,,,,,,,,,,,,,,,,,
Obscuring Mist,29ee4580-9122-11ea-bb37-0242ac130002,Conceal creatures in a cloud of mist.,3A,"material, somatic, verbal",,,2,Arcane,Primal,,,Conjuration,Water,,,,,,,,,,120 feet,20-foot burst,,self,,,,,,1 minute,"You call forth a cloud of mist. All creatures within the mist become concealed, and all creatures outside the mist become concealed to creatures within it. You can Dismiss the cloud.",,,,,,,,,,,,,,,,,,,,,,,,,,100,,Obscuring Mist,Obscuring Mist,,,,,,,,,,,,,,,,,,,,,,,,,,,,,,,,,,,,,,,,,,,,,,,,,,,,,,,,,,,,,,,,,,,,,,,,,,,,,,,,,,,,,,,,,,,,,,,,,,,,,,,,,,,,,,,,,,,,,,,,,,,,,,,,,,,,,,,,,,,,,,,,,,,,,,,,,,,,,,,,,,,,,,,,,,,,,,,,,,,,,,,,,,,,,,,,,,,,,,,,,,,,,,,,,,
Paranoia,29ee463e-9122-11ea-bb37-0242ac130002,Make a creature believe everyone is a threat.,2A,"somatic, verbal",,,2,Occult,,,,Illusion,Mental,,,,,,,,,,30 feet,,1 creature,,TRUE,,,,,1 minute,<var>var1</var>You cause the target to see all other creatures as dire threats. The target is stricken by intense paranoia toward all creatures around it and must attempt a Will save.,Will,The target is unaffected.,"The target believes everyone it sees is a potential threat. It becomes unfriendly to all creatures to which it wasn't already hostile, even those that were previously allies. It treats no one as an ally. The spell ends after 1 round.","As success, but the effect lasts 1 minute.","As failure, except the target believes that everyone it sees is a mortal enemy. It uses its reactions and free actions against everyone, regardless of whether they were previously its allies, as determined by the GM. It otherwise acts as rationally as it normally does and likely prefers to attack creatures that are actively attacking or hindering it over those leaving it alone.",,,You can target up to 5 creatures.,(6th),,,,,,,,,,,,,,,,,,,,,,,,,,,,,,,,,,,,,,,,,,,,,,,,,,,,,,,,,,,,,,,,,,,,,,,,,,,,,,var1,,,,,,,,,,,,,,,,,,,,,,,,,,,,,,,,,,,,,,,,,,,,,,,,,,,,,,,,,,,,,,,,,,,,,,,,,,,,,,,,,,,You can target up to 5 creatures. ,var1,,,,,,,,,,,,,,,,,,,,,,,,,,,,,,,,,,,,,,,,,,,,,,,,,,,,,,,,,,,,,,,,,,,,
Phantom Steed,29ee46f2-9122-11ea-bb37-0242ac130002,Conjure a magical horse.,10 minutes,"somatic, verbal",,,2,Arcane,Occult,Primal,,Conjuration,,,,,,,,,,,30 feet,,,self,,,,,,8 hours,"You conjure a Large, magical, equine creature that only you (or another Medium or Small creature you choose) can ride. The horse is clearly phantasmal in nature, has 20 AC and 10 Hit Points, and automatically fails all saves. If it's reduced to 0 Hit Points, it disappears and the spell ends. <var>var1</var>",,,,,,,,"The steed has a Speed of 60 feet, can walk on water, and ignores areas of natural difficult terrain.",(4th),"The steed has a Speed of 60 feet, can walk on water, and ignores areas of natural difficult terrain. It can also air walk but must end its turn on solid ground or fall.",(5th),"The steed can walk or fly at a Speed of 80 feet, can walk on water, and ignores natural difficult terrain.",(6th),,,,,,,,,,,,,48000,2,Phantom Steed (2nd Level),Phantom Steed,,,48000,4,Phantom Steed (4th Level),Phantom Steed,,,48000,5,Phantom Steed (5th Level),Phantom Steed,,,48000,6,Phantom Steed (6th Level),Phantom Steed,,,,,,,,,,,,,,,,,,,,,,,,,,,,,,,,,,,,,,,"The steed has a Speed of 40 feet and can hold its rider's body weight, plus 20 Bulk.",var1,,,,,,,,,,,,,,,,,,,,,,,,,,,,,,,,,,,"The steed has a Speed of 60 feet, can walk on water, and ignores areas of natural difficult terrain. It can hold its rider's body weight, plus 20 Bulk.",var1,,,,,,,,,,,,,,,,,,,,,,,"The steed has a Speed of 60 feet, can walk on water, and ignores areas of natural difficult terrain. It can also air walk but must end its turn on solid ground or fall. It can hold its rider's body weight, plus 20 Bulk.",var1,,,,,,,,,,,,,,,,,,,,,,,"The steed can walk or fly at a Speed of 80 feet, can walk on water, and ignores natural difficult terrain. It can hold its rider's body weight, plus 20 Bulk.",var1,,,,,,,,,,,,,,,,,,,,,,,,,,,,,,,,,,,,,,,,,,,,,,,,,,,,,,,,,,,,,,,,,,,,
Remove Fear,29ee47b0-9122-11ea-bb37-0242ac130002,Free a creature from its fright.,2A,"somatic, verbal",,,2,Occult,Divine,Primal,,Enchantment,,,,,,,,,You can attempt to counteract a single fear effect that the target suffers from.,,touch,,1 creature,ally,,,,,,,"<var>var1</var>With a touch, you ease a creature's fears. You can attempt to counteract a single fear effect that the target suffers from. This frees only the target, not any other creatures under the fear effect.",,,,,,,,"The spell's range increases to 30 feet, and you can target up to 10 creatures.",(6th),,,,,,,,,,,,,,,,,,,,,,,,,,,,,,,,,,,,,,,,,,,,,,,,,,,,,,,,,,,,,,,,,,,,,,,,,,,,,,var1,,,,,,,,,,,,,,,,,,,,,,,,,,,,,,,,,,,,,,,,,,,,,,,,,,,,,,,,,,,,,,,,,,,,,,,,,,,,,,,,,,,"The spell's range increases to 30 feet, and you can target up to 10 creatures. ",var1,,,,,,,,,,,,,,,,,,,,,,,,,,,,,,,,,,,,,,,,,,,,,,,,,,,,,,,,,,,,,,,,,,,,
Remove Paralysis,29ee49e0-9122-11ea-bb37-0242ac130002,Free a creature from paralysis.,2A,"somatic, verbal",,,2,Occult,Divine,Primal,,Healing,Necromancy,,,,,,,,You can attempt to counteract a single effect imposing the paralyzed condition on the target.,,touch,,1 creature,ally,TRUE,,,,,,"<var>var1</var>A surge of energy frees a paralyzed creature. You can attempt to counteract a single effect imposing the paralyzed condition on the target. This does not cure someone who is paralyzed from some natural state or effect, such as paralysis caused by non-magical wounds or toxins.",,,,,,,,"The spell's range increases to 30 feet, and you can target up to 10 creatures.",(6th),,,,,,,,,,,,,,,,,,,,,,,,,,,,,,,,,,,,,,,,,,,,,,,,,,,,,,,,,,,,,,,,,,,,,,,,,,,,,,var1,,,,,,,,,,,,,,,,,,,,,,,,,,,,,,,,,,,,,,,,,,,,,,,,,,,,,,,,,,,,,,,,,,,,,,,,,,,,,,,,,,,"The spell's range increases to 30 feet, and you can target up to 10 creatures. ",var1,,,,,,,,,,,,,,,,,,,,,,,,,,,,,,,,,,,,,,,,,,,,,,,,,,,,,,,,,,,,,,,,,,,,
Resist Energy,29ee4aa8-9122-11ea-bb37-0242ac130002,Protect a creature from one type of energy damage.,2A,"somatic, verbal",,,2,Arcane,Occult,Divine,Primal,Abjuration,,,,,,,,,,,touch,,1 creature,ally,TRUE,,,,,10 minutes,"<var>var1</var>A shield of elemental energy protects a creature against one type of energy damage. Choose acid, cold, electricity, fire, or sonic damage. The target and its gear gain resistance <var>var2</var> against the damage type you chose.",,,,,,,,"The resistance increases to 10, and you can target up to two creatures.",(4th),"The resistance increases to 15, and you can target up to five creatures.",(7th),,,,,,,,,,,,,,,1000,,Resist Energy,Resist Energy,,,,,,,,,,,,,,,,,,,,,,,,,,,,,,,,,,,,,,,,,,,,,,,,,,,,,,,,,,var1,5,var2,,,,,,,,,,,,,,,,,,,,,,,,,,,,,,,,,You can target up to two creatures.,var1,10,var2,,,,,,,,,,,,,,,,,,,,,,,,,,,,,,,,,,,,,,,,,,,,,,,,,,,,,,,,,,,,,,,,,,,You can target up to five creatures.,var1,15,var2,,,,,,,,,,,,,,,,,,,,,,,,,,,,,,,,,,,,,,,,,,,,
Restoration,29ee4b5c-9122-11ea-bb37-0242ac130002,Reduce a condition or lessen a toxin.,1 minute,"somatic, verbal",,,2,Occult,Divine,Primal,,Healing,Necromancy,,,,,,,,The target can reduce the stage of a toxin or the value of a condition as described.,,touch,,1 creature,ally,TRUE,,,,,,"Restorative magic counters the effects of toxins or conditions that prevent a creature from functioning at its best. When you cast restoration, choose to either reduce a condition or lessen the effect of a toxin. A creature can benefit from only one restoration spell each day, and it can't benefit from restoration more than once to reduce the stage of the same exposure to a given toxin.

<strong>Lessen a Toxin</strong> Reduce the stage of one toxin the target suffers from by <var>var1</var>. This can't reduce the stage below stage 1 or cure the affliction.
<strong>Reduce a Condition</strong> Reduce the value of the target's clumsy, <var>var2</var>enfeebled, or stupefied condition by 2. You can instead reduce two of the listed conditions by 1 each.<var>var3</var>
",,,,,,,,"Add drained to the list of conditions you can reduce. When you lessen a toxin, reduce the stage by two. You also gain a third option that allows you to reduce the target's doomed value by 1. You can't use this to reduce a permanent doomed condition.",(4th),"As the 4th-level restoration, but you can reduce a permanent doomed condition if you add a spellcasting action and a material component while Casting the Spell, during which you provide 100 gp worth of diamond dust as a cost.",(6th),,,,,,,,,,,,,,,,,,,,,,,,,,,,,,,,,,,,,,,,,,,,,,,,,,,,,,,,,,,,,,,,,,,,,,,,,,,one stage,var1,,var2,,var3,,,,,,,,,,,,,,,,,,,,,,,,,,,,,,,two stages,var1,"drained, ",var2,</li><li><strong>Reduce the target's doomed value</strong> Reduce the target's doomed value by 1. You can't use this to reduce a permanent doomed condition.,var3,,,,,,,,,,,,,,,,,,,,,,,,,,,,,,,,,,,,,,,,,,,two stages,var1,"drained, ",var2,"</li><li><strong>Reduce the target's doomed value</strong> Reduce the target's doomed value by 1. You can't use this to reduce a permanent doomed condition. You can reduce a permanent doomed condition if you add a spellcasting action and a material component while Casting the Spell, during which you provide 100 gp worth of diamond dust as a cost.",var3,,,,,,,,,,,,,,,,,,,,,,,,,,,,,,,,,,,,,,,,,,,,,,,,,,,,,,,,,,,,,,,,
Restore Senses,29ee4c1a-9122-11ea-bb37-0242ac130002,Remove a blinding or deafening effect.,2A,"somatic, verbal",,,2,Occult,Divine,Primal,,Healing,Necromancy,,,,,,,,"You attempt to counteract a single effect imposing the blinded or deafened conditions on the target, restoring its vision or hearing.",,touch,,1 creature,ally,TRUE,,,,,,"<var>var1</var>You attempt to counteract a single effect imposing the blinded or deafened conditions on the target, restoring its vision or hearing. This can counteract both temporary magic and permanent consequences of magic, but it doesn't cure someone who does not have the sense due to some natural state or effect, such as from birth or from a non-magical wound or toxin.",,,,,,,,"The spell's range increases to 30 feet, and you can target up to 10 creatures. You can choose the effect to counteract separately for each selected creature.",(6th),,,,,,,,,,,,,,,,,,,,,,,,,,,,,,,,,,,,,,,,,,,,,,,,,,,,,,,,,,,,,,,,,,,,,,,,,,,,,,var1,,,,,,,,,,,,,,,,,,,,,,,,,,,,,,,,,,,,,,,,,,,,,,,,,,,,,,,,,,,,,,,,,,,,,,,,,,,,,,,,,,,"The spell's range increases to 30 feet, and you can target up to 10 creatures. You can choose the effect to counteract separately for each selected creature. ",var1,,,,,,,,,,,,,,,,,,,,,,,,,,,,,,,,,,,,,,,,,,,,,,,,,,,,,,,,,,,,,,,,,,,,
Rime Slick,e3b0a736-661c-455d-a0e0-0cb51e2fb27e,You call down a chill wind.,2A,"somatic, verbal",Pathfinder #151: The Show Must Go On,,2,Arcane,Primal,,,Uncommon,Cold,Evocation,,,,,,,,,60 feet,15-foot burst,,,,,,,,1 minute,"<var>var1</var>You call down a chill wind. When you Cast this Spell, you deal <var>var2</var> cold damage to each creature in the area (basic Reflex save). If a creature in the area critically fails its Reflex save and was standing, it also falls prone.

You also create a layer of ice on all surfaces in the area, which become difficult terrain. Unattended objects in the area become slick with ice, and picking them up requires a successful Reflex save or Acrobatics check against your spell DC. The ice melts on any object that takes fire damage as well as in any square included in the area of a higher-level spell or effect with the fire trait.",basic Reflex,,,,,,,The damage increases to 8d4 cold damage and the area is a 30-foot burst.,(5th),The damage increases to 14d4 cold damage and the area is a 60-foot burst.,(8th),,,,,,,,,,,,,,,100,,Rime Slick,Rime Slick,caster,,,,,,,,,,,,,,,,,,,,,,,,,,,,,,,,,,,,,,,,,,,,,,,,,,,,,,,,,var1,2d4,var2,,,,,,,,,,,,,,,,,,,,,,,,,,,,,,,,,,,,,,,,,,,,,,,,,,,,,,,,,The area is a 30-foot burst. ,var1,8d4,var2,,,,,,,,,,,,,,,,,,,,,,,,,,,,,,,,,,,,,,,,,,,,,,,,,,,,,,,,,,,,,,,,,,,The area is a 60-foot burst. ,var1,14d4,var2,,,,,,,,,,,,,,,,,,,,
Sea Surge,8f8aa561-b706-44c3-ac0e-63f9964b2c98,"You slap or stomp on a nearby solid or liquid surface, sending a surge of water rushing away from you.",2A,"somatic, verbal",Pathfinder #151: The Show Must Go On,,2,Arcane,Primal,,,Uncommon,Evocation,Water,,,,,,,,,,,,,,,,,,until the start of your next turn,"You slap or stomp on a nearby solid or liquid surface, sending a surge of water rushing away from you. The water forms a flat, 5-foot-thick, 10-foot-high wall of water between 5 and 15 feet wide (you decide). It moves 60 feet in a direction of your choice along the struck surface, extinguishing all non-magical fires, carrying along unattended objects of 1 Bulk or less, and pushing larger objects. The wave moves another 60 feet in the same direction at the start of your next turn, then vanishes. Large or smaller creatures in the area or that enter the area the wave moves through must attempt a Fortitude save.",,,The creature is unaffected.,"The creature is knocked prone. If the creature was Swimming, it gets a critical failure instead.","The creature is pushed 20 feet in the waves direction, is knocked prone, and takes 3d6 bludgeoning damage.",,,,,,,,,,,,,,,,,,,,,10,,Sea Surge,Sea Surge,caster,,,,,,,,,,,,,,,,,,,,,,,,,,,,,,,,,,,,,,,,,,,,,,,,,,,,,,,,,var1,2d4,var2,,,,,,,,,,,,,,,,,,,,,,,,,,,,,,,,,,,,,,,,,,,,,,,,,,,,,,,,,The area is a 30-foot burst. ,var1,8d4,var2,,,,,,,,,,,,,,,,,,,,,,,,,,,,,,,,,,,,,,,,,,,,,,,,,,,,,,,,,,,,,,,,,,,The area is a 60-foot burst. ,var1,14d4,var2,,,,,,,,,,,,,,,,,,,,
See Invisibility,29ee4cd8-9122-11ea-bb37-0242ac130002,See invisible creatures and objects.,2A,"somatic, verbal",,,2,Arcane,Occult,Divine,,Divination,Revelation,,,,,,,,,,,,,self,,,,,,10 minutes,"<var>var1</var>You can see invisible creatures and objects. They appear to you as translucent shapes, and they are concealed to you.",,,,,,,,The spell has a duration of 8 hours.,(5th),,,,,,,,,,,,,,,,,1000,2,See Invisibility,See Invisibility,,,48000,5,See Invisibility,See Invisibility,,,,,,,,,,,,,,,,,,,,,,,,,,,,,,,,,,,,,,,,,,,,,,,,,,,,var1,,,,,,,,,,,,,,,,,,,,,,,,,,,,,,,,,,,,,,,,,,,,,,,,,,,,,,,,,,,The spell has a duration of 8 hours. ,var1,,,,,,,,,,,,,,,,,,,,,,,,,,,,,,,,,,,,,,,,,,,,,,,,,,,,,,,,,,,,,,,,,,,,,,,,,,,,,,,,,,,,,,,,,,,,
Shape Wood,29ee4e18-9122-11ea-bb37-0242ac130002,Reshape unworked wood as you choose.,2A,"somatic, verbal",,,2,Primal,,,,Plant,Transmutation,,,,,,,,,,touch,,an unworked piece of wood up to 20 cubic feet in volume,,TRUE,,,,,,"You shape the wood into a rough shape of your choice. The shaping power is too crude to produce with intricate parts, fine details, moving pieces, or the like. You cannot use this spell to enhance the value of the wooden object you are shaping.",,,,,,,,,,,,,,,,,,,,,,,,,,,,,,,,,,,,,,,,,,,,,,,,,,,,,,,,,,,,,,,,,,,,,,,,,,,,,,,,,,,,,,,,,,,,,,,,,,,,,,,,,,,,,,,,,,,,,,,,,,,,,,,,,,,,,,,,,,,,,,,,,,,,,,,,,,,,,,,,,,,,,,,,,,,,,,,,,,,,,,,,,,,,,,,,,,,,,,,,,,,,,,,,,,,,,,,,,,,,,,,,,,,,,,,,,,,,,,,
Shatter,29ee5052-9122-11ea-bb37-0242ac130002,Shatter an object with a high-frequency sonic attack.,2A,"somatic, verbal",,,2,Occult,Primal,,,Evocation,Sonic,,,,,,,,,,30 feet,,1 unattended object,,TRUE,,,,,,"A high-frequency sonic attack shatters a nearby object. You deal <var>var1</var> sonic damage to the object, ignoring the object's Hardness if it is <var>var2</var> or lower.",,,,,,,,"The damage increases by 1d10, and the Hardness the spell ignores increases by 2.",(+1),,,,,,,,,,,,,,,,,,,,,,,,,,,,,,,,,,,,,,,,,,,,,,,,,,,,,,,,,,,,,,,,,,,,,,,,,,,,,2d10,var1,4,var2,,,,,,,,,,,,,,,3d10,var1,6,var2,,,,,,,,,,,,,,,4d10,var1,8,var2,,,,,,,,,,,,,,,,,,,,,5d10,var1,10,var2,,,,,,,,,,,,,,,,,,,,,6d10,var1,12,var2,,,,,,,,,,,,,,,,,,,7d10,var1,14,var2,,,,,,,,,,,,,,,,,,,,,8d10,var1,16,var2,,,,,9d10,var1,18,var2,,,,,10d10,var1,20,var2,,,,
